#EXTM3U

#EXTINF:-1, Avatar Way of Water
http://hd4.dlmania.com/Hollywood/Avatar%20-%20The%20Way%20of%20Water%20-%20BRRip/Avatar%20-%20The%20Way%20of%20Water%20-%20BRRip%20HD%20(HDMp4Mania).mp4
#EXTINF:-1, John Wick 4
http://hd1.dlmania.com/Hollywood/John%20Wick%20-%20Chapter%204%20-%20SCam/John%20Wick%20-%20Chapter%204%20-%20SCam%20HD%20(HDMp4Mania).mp4
#EXTINF:-1, Creed 3
http://hd1.dlmania.com/Hollywood/Creed%20III%20-%20BRRip/Creed%20III%20-%20BRRip%20HD%20(HDMp4Mania).mp4
#EXTINF:-1, Shazam - Fury of the Gods
http://hd1.dlmania.com/Hollywood/Shazam%20-%20Fury%20of%20the%20Gods%20-%20BRRip/Shazam%20-%20Fury%20of%20the%20Gods%20-%20BRRip%20HD%20(HDMp4Mania).mp4
#EXTINF:-1, The Last Kingdom - Seven Kings Must Die
http://hd2.dlmania.com/Hollywood/The%20Last%20Kingdom%20-%20Seven%20Kings%20Must%20Die%20-%20BRRip/The%20Last%20Kingdom%20-%20Seven%20Kings%20Must%20Die%20-%20BRRip%20HD%20(HDMp4Mania).mp4
#EXTINF:-1, A Few Good Men
http://45.200.133.5:8089/A%20Few%20Good%20Men/movie.mkv
#EXTINF:-1, Lord of Rings1
http://45.200.133.5:8089/The%20Lord%20of%20the%20Rings%20The%20Fellowship%20of%20the%20Ring/movie.mp4
#EXTINF:-1, The Passion of Christ
http://45.200.133.5:8089/The%20Passion%20of%20the%20Christ/movie.mp4
#EXTINF:-1, Godfather
http://45.200.133.5:8089/The%20Godfather/movie.mp4
#EXTINF:-1, Godfather2
http://45.200.133.5:8089/The%20Godfather%20Part%202/movie.mp4
#EXTINF:-1, Godfather3
http://45.200.133.5:8089/The%20Godfather%20Part%203/movie.mp4
#EXTINF:-1, Godfather
https://dl3.3rver.org/cdn2/02/film/1972/The%20Godfather/The.Godfather.1972.720p.BluRay.MkvCage.mkv
#EXTINF:-1, Jurassic World Dominion
http://hd1.dlmania.com/Hollywood/Jurassic%20World%20Dominion%20-%20SCam/Jurassic%20World%20Dominion%20-%20SCam%20HD%20(HDMp4Mania).mp4
#EXTINF:-1, Avatar Way of Water
http://hd1.dlmania.com/Hollywood/Avatar%20-%20The%20Way%20of%20Water%20-%20SCam/Avatar%20-%20The%20Way%20of%20Water%20-%20SCam%20HD%20(HDMp4Mania).mp4
#EXTINF:-1, Ant Man and the Wasp Quantumania 
http://hd1.dlmania.com/Hollywood/Ant-Man%20and%20the%20Wasp%20-%20Quantumania%20-%20SCam/Ant-Man%20and%20the%20Wasp%20-%20Quantumania%20-%20SCam%20HD%20(HDMp4Mania).mp4
#EXTINF:-1, John Wick 4
http://hd1.dlmania.com/Hollywood/John%20Wick%20-%20Chapter%204%20-%20SCam/John%20Wick%20-%20Chapter%204%20-%20SCam%20HD%20(HDMp4Mania).mp4

#EXTINF:-1,(500) Days of Summer			
http://vod1.freeddns.org:80/13774202158/500Days.mp4
#EXTINF:-1,[REC]			
http://vod3.freeddns.org:80/195181173146/movies/Rec-2007.mp4
#EXTINF:-1,[REC] 2			
http://vod3.freeddns.org:80/195181173146/movies/Rec2-2009.mp4
#EXTINF:-1,[REC] 3			
http://vod3.freeddns.org:80/195181173146/movies/Rec3-2012.mp4
#EXTINF:-1,[REC] 4: Apocalypse			
http://vod3.freeddns.org:80/195181173146/movies/Rec4-2014.mp4
#EXTINF:-1,1 Buck			
http://vod3.freeddns.org:80/195181164146/1Buck.mp4
#EXTINF:-1,10			
http://vod1.freeddns.org:80/519692115/10000BC.mp4
#EXTINF:-1,10 Cent Pistol			
http://vod3.freeddns.org:80/151809784/10CentPistol.mp4
#EXTINF:-1,10 Rillington Place			
http://vod3.freeddns.org:80/14920271211/10rillingtonplace.mp4
#EXTINF:-1,100 Metros			
http://vod3.freeddns.org:80/1492026922/100metros.mp4
#EXTINF:-1,100 Streets			
http://vod3.freeddns.org:80/151809784/100Streets.mp4
#EXTINF:-1,100%: Julian Edelman			
http://vod3.freeddns.org:80/195181173146/100.per.cent.Julian.Edelman.2019.1080p.WEBRip.x264-RARBG.mp4
#EXTINF:-1,101 Dalmatians			
http://vod3.freeddns.org:80/195181164146/101Dalmatians.mp4
#EXTINF:-1,102 Minutes That Changed America			
http://vod3.freeddns.org:80/217182172100/102Mins.mp4
#EXTINF:-1,102 Not Out			
http://vod3.freeddns.org:80/217182164125/102NotOut.mp4
#EXTINF:-1,10x10			
http://vod5.freeddns.org:80/95154195215/boxoffice/10x10-2018.mp4
#EXTINF:-1,11:14			
http://vod3.freeddns.org:80/195181173146/11.14.2003.720p.BluRay.x264.mp4
#EXTINF:-1,12 Angry Men			
http://vod3.freeddns.org:80/195181164146/12AngryMen.mp4
#EXTINF:-1,12 Rounds 3: Lockdown			
http://vod3.freeddns.org:80/51254199141/12Rounds3Lockdown.mp4
#EXTINF:-1,12 Strong			
http://vod5.freeddns.org:80/95154195215/boxoffice/12Strong-2018.mp4
#EXTINF:-1,12 Wishes of Christmas			
http://vod3.freeddns.org:80/195181164146/12WishesOfChristmas2011.mp4
#EXTINF:-1,12 Years a Slave			
http://vod3.freeddns.org:80/195181164146/12YearsASlave.mp4
#EXTINF:-1,127 Hours			
http://vod3.freeddns.org:80/195181164146/127Hours.mp4
#EXTINF:-1,13 Cameras			
http://vod3.freeddns.org:80/51254199141/13cameras.mp4
#EXTINF:-1,13 Going on 30			
http://vod1.freeddns.org:80/519692115/13GoingOn30.mp4
#EXTINF:-1,13 Hours: The Secret Soldiers of Benghazi			
http://vod3.freeddns.org:80/1492028071/13hours.mp4
#EXTINF:-1,13th			
http://vod3.freeddns.org:80/51254199141/13th.mp4
#EXTINF:-1,14/15 Burnley v QPR			
http://vod1.freeddns.org:80/13774202158/BurQpr.mp4
#EXTINF:-1,14/15 Burnley v Swansea			
http://vod1.freeddns.org:80/148251187141/BurSwa.mp4
#EXTINF:-1,14/15 Burnley v West Brom			
http://vod1.freeddns.org:80/148251187141/BurWba.mp4
#EXTINF:-1,14/15 Newcastle v Aston Villa			
http://vod1.freeddns.org:80/148251187141/NewAvl.mp4
#EXTINF:-1,14/15 Newcastle v Man Utd			
http://vod1.freeddns.org:80/148251187141/NewMun.mp4
#EXTINF:-1,14/15 Newcastle v Stoke			
http://vod1.freeddns.org:80/148251187141/NewStk.mp4
#EXTINF:-1,14/15 QPR v Arsenal			
http://vod1.freeddns.org:80/148251187141/QprArs.mp4
#EXTINF:-1,14/15 QPR v Man Utd			
http://vod1.freeddns.org:80/13774202158/QprMun.mp4
#EXTINF:-1,14/15 QPR v Spurs			
http://vod1.freeddns.org:80/148251187141/QprTot.mp4
#EXTINF:-1,14/15 Southampon v Crystal Palace			
http://vod1.freeddns.org:80/148251187141/SotCry.mp4
#EXTINF:-1,14/15 Southampton v Liverpool			
http://vod1.freeddns.org:80/148251187141/SotLiv.mp4
#EXTINF:-1,14/15 Spurs v Arsenal			
http://vod1.freeddns.org:80/148251187141/TotArs.mp4
#EXTINF:-1,14/15 Spurs v Sunderland			
http://vod1.freeddns.org:80/13774202158/TotSun.mp4
#EXTINF:-1,14/15 Spurs v Swansea			
http://vod1.freeddns.org:80/148251187141/TotSwa.mp4
#EXTINF:-1,14/15 Stoke v Everton			
http://vod1.freeddns.org:80/148251187141/StkEve.mp4
#EXTINF:-1,14/15 Stoke v Hull			
http://vod1.freeddns.org:80/148251187141/StkHul.mp4
#EXTINF:-1,14/15 Stoke v Man City			
http://vod1.freeddns.org:80/148251187141/StkMci.mp4
#EXTINF:-1,14/15 Stoke v Man Utd			
http://vod1.freeddns.org:80/13774202158/StkMun.mp4
#EXTINF:-1,14/15 Stoke v QPR			
http://vod1.freeddns.org:80/148251187141/StkQpr.mp4
#EXTINF:-1,14/15 Sunderland v Burnley			
http://vod1.freeddns.org:80/148251187141/SunBur.mp4
#EXTINF:-1,14/15 Sunderland v Liverpool			
http://vod1.freeddns.org:80/13774202158/SunLiv.mp4
#EXTINF:-1,14/15 Sunderland v West Brom			
http://vod1.freeddns.org:80/148251187141/SunWba.mp4
#EXTINF:-1,14/15 Swansea v Chelsea			
http://vod1.freeddns.org:80/13774202158/SwaChe.mp4
#EXTINF:-1,14/15 Swansea v Man Utd			
http://vod1.freeddns.org:80/148251187141/SwaMun.mp4
#EXTINF:-1,14/15 Swansea v Sunderland			
http://vod1.freeddns.org:80/148251187141/SwaSun.mp4
#EXTINF:-1,14/15 Swansea v West Ham			
http://vod1.freeddns.org:80/13774202158/SwaWhu.mp4
#EXTINF:-1,14/15 WBA v Hull City			
http://vod1.freeddns.org:80/13774202158/WbaHul.mp4
#EXTINF:-1,14/15 WBA v Southampton			
http://vod1.freeddns.org:80/148251187141/WbaSot.mp4
#EXTINF:-1,14/15 West Brom v Spurs			
http://vod1.freeddns.org:80/148251187141/WbaTot.mp4
#EXTINF:-1,14/15 West Brom v Swansea			
http://vod1.freeddns.org:80/148251187141/WbaSwa.mp4
#EXTINF:-1,14/15 West Ham v Chelsea			
http://vod1.freeddns.org:80/148251187141/WhuChe.mp4
#EXTINF:-1,14/15 West Ham v Crystal Palace			
http://vod1.freeddns.org:80/148251187141/WhuCry.mp4
#EXTINF:-1,14/15 West ham v Hull			
http://vod1.freeddns.org:80/13774202158/WhuHul.mp4
#EXTINF:-1,1408			
http://vod1.freeddns.org:80/1482511210/1408.mp4
#EXTINF:-1,15 August			
http://vod3.freeddns.org:80/195181173146/15August.mp4
#EXTINF:-1,16 and Pregnant S05E01			
http://vod1.freeddns.org:80/148251187141/Preg501.mp4
#EXTINF:-1,16 and Pregnant S05E02			
http://vod1.freeddns.org:80/148251187141/Preg502.mp4
#EXTINF:-1,16 and Pregnant S05E03			
http://vod1.freeddns.org:80/148251187141/Preg503.mp4
#EXTINF:-1,16 and Pregnant S05E04			
http://vod1.freeddns.org:80/148251187141/Preg504.mp4
#EXTINF:-1,16 and Pregnant S05E05			
http://vod1.freeddns.org:80/148251187141/Preg505.mp4
#EXTINF:-1,16 and Pregnant S05E06			
http://vod1.freeddns.org:80/148251187141/Preg506.mp4
#EXTINF:-1,16 and Pregnant S05E07			
http://vod1.freeddns.org:80/148251187141/Preg507.mp4
#EXTINF:-1,16 and Pregnant S05E08			
http://vod1.freeddns.org:80/148251187141/Preg508.mp4
#EXTINF:-1,16 and Pregnant S05E09E10			
http://vod1.freeddns.org:80/148251187141/Preg50910.mp4
#EXTINF:-1,16 and Pregnant S05E11E12			
http://vod1.freeddns.org:80/148251187141/Preg51112.mp4
#EXTINF:-1,16 Blocks			
http://vod1.freeddns.org:80/519692115/16Blocks.mp4
#EXTINF:-1,17 Again			
http://vod1.freeddns.org:80/519692115/17Again.mp4
#EXTINF:-1,180° South: Conquerors of the Useless			
http://vod3.freeddns.org:80/195181173146/180.South.2010.720p.BluRay.H264.AAC-RARBG.mp4
#EXTINF:-1,1916: The Irish Rebellion			
http://vod1.freeddns.org:80/1518018170/Irish1916.mp4
#EXTINF:-1,1920 London			
http://vod3.freeddns.org:80/51254199141/1920London.mp4
#EXTINF:-1,1921			
http://vod3.freeddns.org:80/195181164146/1921.mp4
#EXTINF:-1,1922			
http://vod3.freeddns.org:80/195181164146/1922.mp4
#EXTINF:-1,1966 World Cup Final			
http://vod3.freeddns.org:80/195181164146/1966WorldCup.mp4
#EXTINF:-1,1971: Beyond Borders (Dual Audio)			
http://vod3.freeddns.org:80/195181173146/1971BeyondBorders.mp4
#EXTINF:-1,1985			
http://vod3.freeddns.org:80/145239129162/old0619/1985-2018.mp4
#EXTINF:-1,1991			
http://vod3.freeddns.org:80/195181173146/1991.2018.FRENCH.BDRip.XviD-ACOOL.mp4
#EXTINF:-1,2 Guns			
http://vod3.freeddns.org:80/195181164146/TwoGuns2013.mp4
#EXTINF:-1,2 States			
http://vod3.freeddns.org:80/151809610/2States.mp4
#EXTINF:-1,2.0			
http://vod3.freeddns.org:80/14920266145/Robot2.0.mp4
#EXTINF:-1,2:22			
http://vod3.freeddns.org:80/195181164146/222.mp4
#EXTINF:-1,20 Feet from Stardom			
http://vod3.freeddns.org:80/151809610/20Feet.mp4
#EXTINF:-1,2010: The Year We Made Contact			
http://vod3.freeddns.org:80/195181173146/movies/2010TheYearWeMadeContact-1984.mp4
#EXTINF:-1,2016 the End			
http://vod3.freeddns.org:80/195181173146/2016TheEnd.2017.mp4
#EXTINF:-1,2016: Strictly Prom			
http://vod3.freeddns.org:80/1492028071/strictlyprom.mp4
#EXTINF:-1,2036 Origin Unknown			
http://vod5.freeddns.org:80/95154195215/boxoffice/2036OriginUnknown-2018.mp4
#EXTINF:-1,21 Days Under the Sky			
http://vod3.freeddns.org:80/51254199141/21daysunder.mp4
#EXTINF:-1,22 July			
http://vod3.freeddns.org:80/145239129162/old0619/22July-2018.mp4
#EXTINF:-1,2307: Winter\s Dream			
http://vod3.freeddns.org:80/51254199141/2307wintersdream.mp4
#EXTINF:-1,23rd March 1931: Shaheed			
http://vod3.freeddns.org:80/195181173146/23rdMarch1931.mp4
#EXTINF:-1,24 Hours to Live			
http://vod3.freeddns.org:80/217182164125/24HourstoLive.mp4
#EXTINF:-1,24: Redemption			
http://vod3.freeddns.org:80/195181173146/series/24Redemption-2008.mp4
#EXTINF:-1,27 Dresses			
http://vod3.freeddns.org:80/195181173146/movies/27Dresses-2008.mp4
#EXTINF:-1,28 Days Later...			
http://vod1.freeddns.org:80/148251187141/28Days.mp4
#EXTINF:-1,3 Idiots			
http://vod3.freeddns.org:80/195181164146/3Idiots.mp4
#EXTINF:-1,3 Little Pigs and the Magic Lamp			
http://vod3.freeddns.org:80/1492026922/3littlepigs.mp4
#EXTINF:-1,3 Ninjas Knuckle Up			
http://vod3.freeddns.org:80/195181173146/movies/3Ninjas3-1995.mp4
#EXTINF:-1,30 For 30 Nature Boy			
http://vod1.freeddns.org:80/519692115/30For30-NatureBoy-s01e02.mp4
#EXTINF:-1,300: Rise of an Empire			
http://vod1.freeddns.org:80/13774202158/Rise.mp4
#EXTINF:-1,303 Squadron			
http://vod3.freeddns.org:80/14920266145/Squadron.303.2018.720p.BluRay.H264.AAC-RARBG.mp4
#EXTINF:-1,3096 Days			
http://vod3.freeddns.org:80/195181173146/movies/3096Days-2013.mp4
#EXTINF:-1,31			
http://vod1.freeddns.org:80/1518018170/31.mp4
#EXTINF:-1,36 Vayadhinile			
http://vod3.freeddns.org:80/151809610/36Vayadhinile.mp4
#EXTINF:-1,40 Days and 40 Nights			
http://vod1.freeddns.org:80/519692115/40DaysAnd40Nights.mp4
#EXTINF:-1,45 Years			
http://vod3.freeddns.org:80/1492026922/45Years.mp4
#EXTINF:-1,48 Hrs.			
http://vod3.freeddns.org:80/519682224/48Hours-1982.mp4
#EXTINF:-1,4Got10			
http://vod3.freeddns.org:80/217182172100/4Got10.mp4
#EXTINF:-1,5 Flights Up			
http://vod3.freeddns.org:80/51254199141/5FlightsUp.mp4
#EXTINF:-1,5 Weddings			
http://vod3.freeddns.org:80/195181173146/5Weddings.mp4
#EXTINF:-1,5000/1 How Leicester City Beat the Odds			
http://vod3.freeddns.org:80/14920271211/50001.mp4
#EXTINF:-1,54 Hours: The Gladbeck Hostage Crisis			
http://vod3.freeddns.org:80/145239129162/54HoursTheGladbeckHostageCrisis-s01e04.mp4
#EXTINF:-1,6 Below: Miracle on the Mountain			
http://vod3.freeddns.org:80/195181164146/6BelowMiracleOnOheMountain.mp4
#EXTINF:-1,6 Days			
http://vod3.freeddns.org:80/519682224/6Days.mp4
#EXTINF:-1,60 Days on the Streets			
http://vod3.freeddns.org:80/145239129162/60DaysOnTheStreets-s01e03.mp4
#EXTINF:-1,60th Annual GRAMMY Awards 2018			
http://vod3.freeddns.org:80/195181164146/GrammyAwards2018.mp4
#EXTINF:-1,62nd JIO Filmfare Awards			
http://vod3.freeddns.org:80/195181164146/62ndJIOFilmfareAwards.mp4
#EXTINF:-1,633 Squadron			
http://vod3.freeddns.org:80/195181173146/movies/633Squadron-1964.mp4
#EXTINF:-1,64th Filmfare Awards			
http://vod3.freeddns.org:80/195181173146/64thFilmfareAwards.mp4
#EXTINF:-1,68 Kill			
http://vod3.freeddns.org:80/1492026922/68Kill.mp4
#EXTINF:-1,7 Minutes			
http://vod1.freeddns.org:80/1482511210/7minutes.mp4
#EXTINF:-1,71			
http://vod3.freeddns.org:80/195181164146/71.mp4
#EXTINF:-1,72 Hours: Martyr Who Never Died			
http://vod3.freeddns.org:80/195181173146/72Hours.mp4
#EXTINF:-1,8 Half			
http://vod1.freeddns.org:80/148251187141/8Half.mp4
#EXTINF:-1,8 Mile			
http://vod1.freeddns.org:80/1482511210/8MileA.mp4
#EXTINF:-1,8 Out Of 10 Cats Does Countdown Channel 4 Mashup			
http://vod1.freeddns.org:80/1518018170/series/8OutOf10CatsDoesCountdown-s00e02.mp4
#EXTINF:-1,84 Charing Cross Road			
http://vod3.freeddns.org:80/195181173146/84.Charing.Cross.Road.1986.720p.NF.WEBRip.DDP2.0.x264-EXREN.mp4
#EXTINF:-1,88 Minutes			
http://vod1.freeddns.org:80/519692115/88Minutes.mp4
#EXTINF:-1,9			
http://vod3.freeddns.org:80/1492026922/9.mp4
#EXTINF:-1,9/11 Truth			
http://vod3.freeddns.org:80/51254199141/911truth.mp4
#EXTINF:-1,96			
http://vod3.freeddns.org:80/195181173146/96.mp4
#EXTINF:-1,99 Homes			
http://vod3.freeddns.org:80/1492026922/99Homes.mp4
#EXTINF:-1,A & E Biography Serial Killers (Series)			
http://vod3.freeddns.org:80/151809784/series/aandebiographyserialkillers-s01e20.mp4
#EXTINF:-1,A Aa (Hindi)			
http://vod5.freeddns.org:80/95154195215/boxoffice2/A.Aa.2016.mp4
#EXTINF:-1,A Bad Moms Christmas			
http://vod3.freeddns.org:80/14920271211/ABadMomsChristmas.mp4
#EXTINF:-1,A Beautiful Mind			
http://vod3.freeddns.org:80/195181164146/BeautifulMind.mp4
#EXTINF:-1,A Bridge Too Far (English Subs)			
http://vod1.freeddns.org:80/1518018170/ABridgeTooFar.mp4
#EXTINF:-1,A Brilliant Young Mind			
http://vod3.freeddns.org:80/151809610/XY.mp4
#EXTINF:-1,A Bug\s Life			
http://vod1.freeddns.org:80/13774202158/BugsLife.mp4
#EXTINF:-1,A Charlie Brown Christmas			
http://vod1.freeddns.org:80/519692115/CharlieXmas.mp4
#EXTINF:-1,A Christmas Prince: The Royal Wedding			
http://vod3.freeddns.org:80/195181173146/A.Christmas.Prince.The.Royal.Wedding.2018.720p.WEBRip.x264-RARBG.mp4
#EXTINF:-1,A Christmas Recipe for Romance			
http://vod3.freeddns.org:80/195181173146/A.Christmas.Recipe.for.Romance.2019.1080p.HDTV.x264-CRiMSON.mp4
#EXTINF:-1,A Christmas Star			
http://vod3.freeddns.org:80/217182172100/AChristmasStar.mp4
#EXTINF:-1,A Christmas Story			
http://vod3.freeddns.org:80/217182172100/XmasStory.mp4
#EXTINF:-1,A Christmas Tale			
http://vod3.freeddns.org:80/217182172100/Achristtale.mp4
#EXTINF:-1,A Cinderella Story: Christmas Wish			
http://vod3.freeddns.org:80/195181173146/A.Cinderella.Story.Christmas.Wish.2019.720p.BluRay.H264.AAC-RARBG.mp4
#EXTINF:-1,A Cinderella Story: If the Shoe Fits			
http://vod3.freeddns.org:80/14920266145/ACinderellaStoryIfTheShoeFits-2016.mp4
#EXTINF:-1,A Cinderella Story: Once Upon a Song			
http://vod3.freeddns.org:80/14920266145/ACinderellaStoryOnceUponASong-2011.mp4
#EXTINF:-1,A Conspiracy of Faith			
http://vod3.freeddns.org:80/1492028071/AConspiracyOfFaith.mp4
#EXTINF:-1,A Cool Fish			
http://vod3.freeddns.org:80/195181173146/A.Cool.Fish.2018.CHINESE.1080p.WEBRip.AAC2.0.x264-NOGRP.mp4
#EXTINF:-1,A Cry for Help			
http://vod3.freeddns.org:80/145239129162/Acryforhelp.mp4
#EXTINF:-1,A Cure for Wellness			
http://vod3.freeddns.org:80/14920271211/acureforwellness.mp4
#EXTINF:-1,A Dandy in Aspic			
http://vod3.freeddns.org:80/195181173146/A.Dandy.In.Aspic.1968.720p.BluRay.x264.mp4
#EXTINF:-1,A Dangerous Game			
http://vod3.freeddns.org:80/1492026922/adangerousgame.mp4
#EXTINF:-1,A Dark Song			
http://vod3.freeddns.org:80/195181164146/ADarkSong.mp4
#EXTINF:-1,A Date by Christmas Eve			
http://vod3.freeddns.org:80/195181173146/a.date.by.christmas.eve.2019.720p.web.h264-tbs.mp4
#EXTINF:-1,A Day at the Races			
http://vod3.freeddns.org:80/195181173146/ADayAtTheRaces1937.mp4
#EXTINF:-1,A Dog\s Journey			
http://vod3.freeddns.org:80/14920266145/ADogsJourney-2019.mp4
#EXTINF:-1,A Dog\s Purpose			
http://vod3.freeddns.org:80/1492028071/adogspurpose.mp4
#EXTINF:-1,A Dog\s Way Home			
http://vod3.freeddns.org:80/14920266145/ADogsWayHome-2019.mp4
#EXTINF:-1,A Few Best Men			
http://vod3.freeddns.org:80/1492028071/afewbestmen.mp4
#EXTINF:-1,A Few Good Men			
http://vod3.freeddns.org:80/195181164146/afewgoodmen.mp4
#EXTINF:-1,A Few Less Men			
http://vod3.freeddns.org:80/1492028071/afewlessmen.mp4
#EXTINF:-1,A Fish Called Wanda			
http://vod3.freeddns.org:80/195181173146/movies/AFishCalledWanda-1988.mp4
#EXTINF:-1,A Fistful of Dollars			
http://vod1.freeddns.org:80/1482511210/AFistful.mp4
#EXTINF:-1,A Flying Jatt			
http://vod1.freeddns.org:80/1518018170/AFlyingJatt.mp4
#EXTINF:-1,A Frozen Christmas 2			
http://vod3.freeddns.org:80/195181173146/a.frozen.christmas.2.2017.dvdrip.x264-spooks.mp4
#EXTINF:-1,A Frozen Christmas 2 (Hindi)			
http://vod3.freeddns.org:80/195181173146/AFrozenChristmas2-hindi.mp4
#EXTINF:-1,A Frozen Christmas 3			
http://vod5.freeddns.org:80/95154195215/boxoffice2/A.Frozen.Christmas.3.2018.720p.WEBRip.x264.mp4
#EXTINF:-1,A Garfield Christmas Special			
http://vod1.freeddns.org:80/519692115/Garfield-AGarfieldChristmasSpecial.mp4
#EXTINF:-1,A Gentleman			
http://vod3.freeddns.org:80/195181164146/AGentleman.mp4
#EXTINF:-1,A Ghost of a Chance			
http://vod3.freeddns.org:80/195181173146/A.Ghost.Of.A.Chance.2011.JAPANESE.1080p.BluRay.H264.AAC-VXT.mp4
#EXTINF:-1,A Ghost Story			
http://vod1.freeddns.org:80/14920220391/AGhostStory.mp4
#EXTINF:-1,A Girl Walks Home Alone at Night			
http://vod3.freeddns.org:80/217182172100/AGirlWalks.mp4
#EXTINF:-1,A Good Year			
http://vod1.freeddns.org:80/519692115/AGoodYear.mp4
#EXTINF:-1,A Haunted House			
http://vod1.freeddns.org:80/519692115/AHauntedHouse.mp4
#EXTINF:-1,A Haunted House 2			
http://vod1.freeddns.org:80/519692115/AHauntedHouse2.mp4
#EXTINF:-1,A History of Violence			
http://vod3.freeddns.org:80/195181173146/movies/AHistoryOfViolence-2005.mp4
#EXTINF:-1,A House In The Hills			
http://vod3.freeddns.org:80/195181173146/A.House.In.The.Hills.1993.720p.AMZN.WEB-DL.DDP2.0.H.264-ABM.mp4
#EXTINF:-1,A Leaf of Faith			
http://vod3.freeddns.org:80/195181173146/A.Leaf.Of.Faith.2018.720p.WEBRip.x264.mp4
#EXTINF:-1,A League of Their Own			
http://vod3.freeddns.org:80/51254199141/ALeagueOfTheirOwn.mp4
#EXTINF:-1,A Little Chaos			
http://vod3.freeddns.org:80/151809610/ALittleChaos.mp4
#EXTINF:-1,A Madea Christmas			
http://vod3.freeddns.org:80/1492026922/AMadeaChristmas.mp4
#EXTINF:-1,A Man Called Ove (English Subs)			
http://vod3.freeddns.org:80/151809610/AManCalledOve.mp4
#EXTINF:-1,A Merry Friggin\ Christmas			
http://vod3.freeddns.org:80/217182172100/XmasFrig.mp4
#EXTINF:-1,A Million Ways to Die in the West			
http://vod5.freeddns.org:80/95154195215/boxoffice2/MillionWaysToDieInTheWest-2014.mp4
#EXTINF:-1,A Moment to Remember			
http://vod3.freeddns.org:80/195181173146/A.Moment.to.Remember.2004.DC.KOREAN.1080p.BluRay.H264.AAC-VXT.mp4
#EXTINF:-1,A Monster Calls			
http://vod3.freeddns.org:80/51254199141/AMonsterCalls.mp4
#EXTINF:-1,A Most Violent Year			
http://vod1.freeddns.org:80/148251187141/ViolentYear.mp4
#EXTINF:-1,A Mother\s Nightmare			
http://vod3.freeddns.org:80/195181173146/A.Mothers.Nightmare.2012.1080p.WEBRip.x264-RARBG.mp4
#EXTINF:-1,A Night at the Opera			
http://vod3.freeddns.org:80/195181173146/A.Night.at.the.Opera.1935.720p.WEB-DL.AAC.2.0.H264-FGT.mp4
#EXTINF:-1,A Nightmare on Elm Street			
http://vod3.freeddns.org:80/195181164146/NightmareOnElmStreet(2010).mp4
#EXTINF:-1,A Nutcracker Christmas			
http://vod3.freeddns.org:80/195181164146/NutcrackerChristmas2016.mp4
#EXTINF:-1,A Patch of Fog			
http://vod3.freeddns.org:80/151809784/APatchofFog.mp4
#EXTINF:-1,A Perfect Day			
http://vod3.freeddns.org:80/51254199141/perfectday.mp4
#EXTINF:-1,A Princess for Christmas			
http://vod3.freeddns.org:80/217182164125/APrincessForChristmas.mp4
#EXTINF:-1,A Private War			
http://vod3.freeddns.org:80/145239129162/old0619/APrivateWar-2018.mp4
#EXTINF:-1,A Prophet			
http://vod3.freeddns.org:80/195181173146/movies/UnProphete-2009.mp4
#EXTINF:-1,A Quiet Passion			
http://vod3.freeddns.org:80/1492028071/AQuietPassion.mp4
#EXTINF:-1,A Quiet Place			
http://vod3.freeddns.org:80/14920266145/AQuietPlace-2018.mp4
#EXTINF:-1,A Record of Sweet Murderer			
http://vod3.freeddns.org:80/195181173146/A.Record.Of.Sweet.Murderer.2014.JAPANESE.720p.BluRay.H264.AAC-VXT.mp4
#EXTINF:-1,A Royal Night Out			
http://vod3.freeddns.org:80/1492028071/ARoyal.mp4
#EXTINF:-1,A Score to Settle			
http://vod3.freeddns.org:80/14920266145/A.Score.to.Settle.mp4
#EXTINF:-1,A Shoe Addict\s Christmas			
http://vod3.freeddns.org:80/195181173146/A.Shoe.Addicts.Christmas.2018.720p.AMZN.WEB-DL.DDP5.1.H.264-DbS.mp4
#EXTINF:-1,A Simple Favor			
http://vod5.freeddns.org:80/95154195215/boxoffice2/ASimpleFavor-2018.mp4
#EXTINF:-1,A Sound of Thunder			
http://vod3.freeddns.org:80/195181173146/movies/ASoundOfThunder-2005.mp4
#EXTINF:-1,A StoryBots Christmas 2017			
http://vod3.freeddns.org:80/217182164125/StorybotsXmas2017.mp4
#EXTINF:-1,A Street Cat Named Bob			
http://vod3.freeddns.org:80/51254199141/AStreetCat.mp4
#EXTINF:-1,A Tale of Two Sisters			
http://vod3.freeddns.org:80/217182172100/ATale.mp4
#EXTINF:-1,A Time to Kill			
http://vod1.freeddns.org:80/1482511210/atimetokill.mp4
#EXTINF:-1,A Touch of Sin (Tian zhu ding)			
http://vod3.freeddns.org:80/195181164146/ATouchofSin.mp4
#EXTINF:-1,A Very British Gangster			
http://vod3.freeddns.org:80/217182172100/Gangster.mp4
#EXTINF:-1,A Very English Scandal			
http://vod3.freeddns.org:80/145239129162/AVeryEnglishScandal-s01e03.mp4
#EXTINF:-1,A Very Merry Toy Store			
http://vod3.freeddns.org:80/195181173146/A.Very.Merry.Toy.Store.2017.1080p.WEBRip.x264-RARBG.mp4
#EXTINF:-1,A Very Murray Christmas			
http://vod3.freeddns.org:80/195181173146/A.Very.Murray.Christmas.2015.720p.WEBRip.x264-RARBG.mp4
#EXTINF:-1,A Very Sordid Wedding			
http://vod3.freeddns.org:80/217182132110/AVerySordidWedding.mp4
#EXTINF:-1,A Very Wicked Halloween Celebrating 15 Years on Broadway			
http://vod3.freeddns.org:80/145239129162/old0619/a.very.wicked.halloween.celebrating.15.years.on.broadway.2018.1080p.web.x264-tbs.mp4
#EXTINF:-1,A View to a Kill			
http://vod3.freeddns.org:80/14920271211/aviewtokill.mp4
#EXTINF:-1,A Vigilante			
http://vod3.freeddns.org:80/14920266145/AVigilante-2018-720p.mp4
#EXTINF:-1,A Walk Among the Tombstones			
http://vod3.freeddns.org:80/195181164146/AWalkAmongtheTombstones.mp4
#EXTINF:-1,A Walk to Remember			
http://vod3.freeddns.org:80/519682224/awalktoremember.mp4
#EXTINF:-1,A Wrinkle in Time			
http://vod5.freeddns.org:80/95154195215/boxoffice/AWrinkleInTime-2018.mp4
#EXTINF:-1,¡Three Amigos!			
http://vod3.freeddns.org:80/519682224/threeamigos.mp4
#EXTINF:-1,Aa ab Laut Chalen			
http://vod3.freeddns.org:80/195181173146/AaAbLautChalen.mp4
#EXTINF:-1,Aa Gaya Hero			
http://vod3.freeddns.org:80/195181164146/AagayaHero.mp4
#EXTINF:-1,Aaja Nachle			
http://vod1.freeddns.org:80/519692115/AajaNachle.mp4
#EXTINF:-1,Aakhri Cheekh			
http://vod3.freeddns.org:80/195181173146/AakhriCheekh.mp4
#EXTINF:-1,Aalavandhan			
http://vod3.freeddns.org:80/195181164146/Abhay.mp4
#EXTINF:-1,Aamir			
http://vod3.freeddns.org:80/151809610/Aamir.mp4
#EXTINF:-1,Aapne To Dhirubhai (Gujarati)			
http://vod3.freeddns.org:80/51254199141/AapneToDhirubhai.mp4
#EXTINF:-1,Aarzoo			
http://vod3.freeddns.org:80/195181173146/Aarzoo.mp4
#EXTINF:-1,Aate Di Chidi (Punjabi)			
http://vod3.freeddns.org:80/195181173146/Aatedichidi.mp4
#EXTINF:-1,Aav Taru Kari Nakhu (Gujarati)			
http://vod3.freeddns.org:80/195181173146/AavTaruKariNakhu.mp4
#EXTINF:-1,Ab Tak Chhappan			
http://vod3.freeddns.org:80/217182172100/AbTak.mp4
#EXTINF:-1,Ab Tak Chhappan 2			
http://vod1.freeddns.org:80/519692115/AbTak2.mp4
#EXTINF:-1,Abandoned			
http://vod3.freeddns.org:80/195181173146/Abandoned.2015.720p.BluRay.x264.mp4
#EXTINF:-1,Abattoir			
http://vod3.freeddns.org:80/51254199141/Abattoir.mp4
#EXTINF:-1,Abbott and Costello Hit It Ain\t Hay			
http://vod3.freeddns.org:80/195181173146/Abbott.And.Costello.It.Aint.Hay.1943.720p.BluRay.H264.AAC-RARBG.mp4
#EXTINF:-1,Abbott and Costello Hit the Ice			
http://vod3.freeddns.org:80/195181173146/Abbott.And.Costello.Hit.The.Ice.1943.720p.BluRay.H264.AAC-RARBG.mp4
#EXTINF:-1,Abbott and Costello Keep \Em Flying			
http://vod3.freeddns.org:80/195181173146/Abbott.And.Costello.Keep.Em.Flying.1941.1080p.BluRay.H264.AAC-RARBG.mp4
#EXTINF:-1,Abbott and Costello Meet the Invisible Man			
http://vod3.freeddns.org:80/195181173146/Bud.Abbott.Lou.Costello.Meet.The.Invisible.Man.1951.720p.BluRay.x264.mp4
#EXTINF:-1,ABC TV Nursery Rhymes			
http://vod3.freeddns.org:80/14920271211/abctv.mp4
#EXTINF:-1,ABCD			
http://vod3.freeddns.org:80/151809610/ABCD.mp4
#EXTINF:-1,Abducted in Plain Sight			
http://vod3.freeddns.org:80/145239129162/Abducted.in.Plain.Sight.mp4
#EXTINF:-1,Abhay			
http://vod3.freeddns.org:80/195181173146/Abhay.mp4
#EXTINF:-1,About Last Night...			
http://vod3.freeddns.org:80/195181173146/About.Last.Night.1986.720p.BluRay.H264.AAC-RARBG.mp4
#EXTINF:-1,About Scout			
http://vod3.freeddns.org:80/1492028071/aboutscout.mp4
#EXTINF:-1,About Time			
http://vod1.freeddns.org:80/519692115/abouttime.mp4
#EXTINF:-1,Above and Beyond			
http://vod1.freeddns.org:80/1518018170/AboveandBeyond.mp4
#EXTINF:-1,Above the Shadows			
http://vod3.freeddns.org:80/14920266145/AboveTheShadows-2019.mp4
#EXTINF:-1,Abraham Lincoln: Vampire Hunter			
http://vod3.freeddns.org:80/195181164146/AbrahamLincolnVampireHunter.mp4
#EXTINF:-1,Absolute Power			
http://vod3.freeddns.org:80/145239129162/AbsolutePower.mp4
#EXTINF:-1,Absolutely Anything			
http://vod3.freeddns.org:80/217182172100/AbsolutelyAnything.mp4
#EXTINF:-1,Accepted			
http://vod1.freeddns.org:80/519692115/Accepted.mp4
#EXTINF:-1,Ace High			
http://vod3.freeddns.org:80/195181173146/movies/AceHigh-1968.mp4
#EXTINF:-1,Ace Ventura: Pet Detective			
http://vod3.freeddns.org:80/217182172100/PetDick.mp4
#EXTINF:-1,Ace Ventura: When Nature Calls			
http://vod3.freeddns.org:80/1492026922/ace.mp4
#EXTINF:-1,Achamindri			
http://vod3.freeddns.org:80/195181173146/Achamindri.mp4
#EXTINF:-1,Across the Universe			
http://vod1.freeddns.org:80/519692115/AcrossTheUniverse.mp4
#EXTINF:-1,Action			
http://vod3.freeddns.org:80/195181173146/series/Action2019-s01e03.mp4
#EXTINF:-1,Action Man Charlie (Charlie) (Hindi Dub)			
http://vod3.freeddns.org:80/195181164146/ActionManCharlie.mp4
#EXTINF:-1,Action Point			
http://vod5.freeddns.org:80/95154195215/boxoffice/ActionPoint-2018.mp4
#EXTINF:-1,Actor in Law (Urdu)			
http://vod3.freeddns.org:80/195181164146/ActorInLaw.mp4
#EXTINF:-1,Acts of Vengeance			
http://vod3.freeddns.org:80/195181164146/ActsofVengeance.mp4
#EXTINF:-1,Acts of Violence			
http://vod1.freeddns.org:80/14920220391/ActsOfViolence.mp4
#EXTINF:-1,Adam & Steve			
http://vod1.freeddns.org:80/519692115/AdamAndSteve.mp4
#EXTINF:-1,Adam Joan (Malayalam) (English Subs)			
http://vod1.freeddns.org:80/14920220391/AdamJoan.mp4
#EXTINF:-1,Adam Sandler: 100% Fresh			
http://vod3.freeddns.org:80/519682224/AdamSandler100PercentFresh.mp4
#EXTINF:-1,Adams æbler (Adam\s Apples) (English Subs)			
http://vod3.freeddns.org:80/195181164146/AdamsAebler.mp4
#EXTINF:-1,Addams Family Values			
http://vod3.freeddns.org:80/195181164146/AddamsFamilyValues.mp4
#EXTINF:-1,Addicted to Sexting			
http://vod1.freeddns.org:80/519692115/sexting.mp4
#EXTINF:-1,Adele Live in New York			
http://vod3.freeddns.org:80/217182172100/adelelive.mp4
#EXTINF:-1,Adopt a Highway			
http://vod3.freeddns.org:80/14920266145/AdoptAHighway-2019.mp4
#EXTINF:-1,Adopting Trouble			
http://vod3.freeddns.org:80/195181173146/movies/AdoptingTrouble-2016.mp4
#EXTINF:-1,Adrift			
http://vod5.freeddns.org:80/95154195215/boxoffice/Adrift-2018.mp4
#EXTINF:-1,Adrishya			
http://vod3.freeddns.org:80/195181173146/Adrishya.mp4
#EXTINF:-1,Adulthood			
http://vod3.freeddns.org:80/1492028071/Adulthood.mp4
#EXTINF:-1,Adventureland			
http://vod1.freeddns.org:80/519692115/Adventureland.mp4
#EXTINF:-1,Adventures of Aladdin			
http://vod3.freeddns.org:80/14920266145/AdventuresofAladdin.mp4
#EXTINF:-1,AEW All Out 2019			
http://vod3.freeddns.org:80/195181173146/wwe/AEW-AllOut2019.mp4
#EXTINF:-1,AEW Fight for the Fallen			
http://vod3.freeddns.org:80/145239129162/AEWFallen.mp4
#EXTINF:-1,AEW Full Gear 2019			
http://vod3.freeddns.org:80/195181173146/wwe/AEW-FullGear2019.mp4
#EXTINF:-1,AEW Fyter Fest 2019			
http://vod3.freeddns.org:80/145239129162/AEWFyterFest.mp4
#EXTINF:-1,AEW: Dark 04/02/20			
http://vod3.freeddns.org:80/195181173146/wwe/AEW-DARK-2020-02-04.mp4
#EXTINF:-1,AEW: Double or Nothing 2019			
http://vod1.freeddns.org:80/95154195215m/AEWDouble.mpg
#EXTINF:-1,After Darkness			
http://vod5.freeddns.org:80/95154195215/boxoffice2/After.Darkness.2018.720p.WEBRip.x264.mp4
#EXTINF:-1,After Hours			
http://vod3.freeddns.org:80/519682224/AfterHours-1985.mp4
#EXTINF:-1,After Hours Season 1 E1-E6			
http://vod1.freeddns.org:80/519692115/afterhours-s01e06.mp4
#EXTINF:-1,After the Wedding			
http://vod3.freeddns.org:80/14920266145/AfterTheWedding-2019.mp4
#EXTINF:-1,Aftermath			
http://vod1.freeddns.org:80/1518018170/Aftermath.mp4
#EXTINF:-1,Agatha and the Truth of Murder			
http://vod1.freeddns.org:80/95154195215m/old0619/AgathaAndTheTruthOfMurder-2018.mp4
#EXTINF:-1,Agent Cody Banks			
http://vod1.freeddns.org:80/519692115/AgentCodyBanks.mp4
#EXTINF:-1,Agneepath			
http://vod1.freeddns.org:80/519692115/Agneepath.mp4
#EXTINF:-1,Agnyaathavaasi (Hindi Dub)			
http://vod3.freeddns.org:80/195181173146/Agnyaathavaasi.mp4
#EXTINF:-1,Agnyaathavaasi (Telugu)			
http://vod3.freeddns.org:80/195181164146/Agnyaathavaasi.mp4
#EXTINF:-1,Aiba Awards 2015 IcTv 7th Anniversary Exclusive			
http://vod3.freeddns.org:80/151809610/Aiba.mp4
#EXTINF:-1,Aileen: Life and Death of a Serial Killer			
http://vod3.freeddns.org:80/195181164146/Aileen.mp4
#EXTINF:-1,Air			
http://vod3.freeddns.org:80/151809610/Air.mp4
#EXTINF:-1,Air Strike			
http://vod5.freeddns.org:80/95154195215/boxoffice2/AirStrike-2018.mp4
#EXTINF:-1,Airaa			
http://vod3.freeddns.org:80/195181173146/Airaa.mp4
#EXTINF:-1,Airheads			
http://vod3.freeddns.org:80/195181173146/Airheads.1994.720p.BluRay.x264.mp4
#EXTINF:-1,Airlift			
http://vod1.freeddns.org:80/519692115/Airlift.mp4
#EXTINF:-1,Airplane Repo Season 1			
http://vod3.freeddns.org:80/1492026922/airplanerepo-s01e13.mp4
#EXTINF:-1,Airport			
http://vod1.freeddns.org:80/1518018170/Airport.mp4
#EXTINF:-1,Aitraaz			
http://vod3.freeddns.org:80/51254199141/Aitraaz.mp4
#EXTINF:-1,Aiyaary			
http://vod5.freeddns.org:80/95154195215/boxoffice/Aiyaary.mp4
#EXTINF:-1,Ajab Prem Ki Ghazab Kahani			
http://vod3.freeddns.org:80/195181164146/AjabPremKiGhazabKahani.mp4
#EXTINF:-1,Ajji			
http://vod5.freeddns.org:80/95154195215/boxoffice/Ajji.mp4
#EXTINF:-1,Akaash Vani			
http://vod5.freeddns.org:80/95154195215/boxoffice/AkaashVani.mp4
#EXTINF:-1,Aksar 2			
http://vod3.freeddns.org:80/217182164138/Aksar2.mp4
#EXTINF:-1,Aladdin			
http://vod1.freeddns.org:80/1482511210/Aladdin.mp4
#EXTINF:-1,Aladdin (2019)			
http://vod3.freeddns.org:80/14920266145/Aladdin-2019.mp4
#EXTINF:-1,Alan Partridge: Alpha Papa			
http://vod3.freeddns.org:80/1492028071/alphapapa.mp4
#EXTINF:-1,Alan Partridge\s Scissored Isle			
http://vod3.freeddns.org:80/195181164146/AlanPartridgeScissoredIsle.mp4
#EXTINF:-1,Alaska Fish Wars Season 1			
http://vod3.freeddns.org:80/145239129162/AlaskaFishWars-s01e03.mp4
#EXTINF:-1,Albert  Pinto Ko Gussa Kyun Aata Hai?			
http://vod3.freeddns.org:80/195181173146/AlbertPinto.mp4
#EXTINF:-1,Alex Cross			
http://vod3.freeddns.org:80/151809784/AlexCross.mp4
#EXTINF:-1,Alfie			
http://vod3.freeddns.org:80/217182172100/Alfie.mp4
#EXTINF:-1,Ali G Indahouse			
http://vod3.freeddns.org:80/1492028071/AliG.mp4
#EXTINF:-1,Alias Jesse James			
http://vod5.freeddns.org:80/95154195215/boxoffice/AliasJesseJames-1959.mp4
#EXTINF:-1,Alibaba Aur 40 Chor			
http://vod3.freeddns.org:80/195181164146/AlibabaAur40Chor.mp4
#EXTINF:-1,Alice Through the Looking Glass (3D)			
http://vod3.freeddns.org:80/1492028071/Alice3D.mp4
#EXTINF:-1,Alien			
http://vod3.freeddns.org:80/195181164146/Alien.mp4
#EXTINF:-1,Alien Abduction			
http://vod3.freeddns.org:80/217182172100/AlienAb.mp4
#EXTINF:-1,Alien Expedition			
http://vod3.freeddns.org:80/145239129162/old0619/AlienExpeditionVoyageIntoFear-2018.mp4
#EXTINF:-1,Alien Invasion: S.U.M.1			
http://vod3.freeddns.org:80/217182164125/SUM1.mp4
#EXTINF:-1,Alien vs. Predator			
http://vod1.freeddns.org:80/519692115/AlienVsPredator.mp4
#EXTINF:-1,Alien: Resurrection			
http://vod3.freeddns.org:80/217182172100/AlienR.mp4
#EXTINF:-1,Aliens			
http://vod3.freeddns.org:80/195181164146/Aliens.mp4
#EXTINF:-1,Aliens of the Deep			
http://vod3.freeddns.org:80/51254199141/AliensDeep.mp4
#EXTINF:-1,Aliens vs Predator: Requiem			
http://vod1.freeddns.org:80/519692115/AliensVsPredator-Requiem.mp4
#EXTINF:-1,Aliens: Zone of Silence			
http://vod3.freeddns.org:80/195181173146/Aliens.Zone.Of.Silence.2017.720p.WEBRip.x264.mp4
#EXTINF:-1,Aligarh			
http://vod3.freeddns.org:80/195181164146/Aligarh.mp4
#EXTINF:-1,Alive			
http://vod3.freeddns.org:80/14920271211/Alive.mp4
#EXTINF:-1,All About Eve			
http://vod3.freeddns.org:80/195181164146/AllAboutEve.mp4
#EXTINF:-1,All Access 24/7 GGG Golovkin vs Daniel Jacobs Boxing			
http://vod3.freeddns.org:80/14920271211/gggjacobsallaccess.mp4
#EXTINF:-1,All Access Mayweather vs McGregor			
http://vod3.freeddns.org:80/14920271211/sport/MayweatherVsMcGregor-AllAccess-s01e03.mp4
#EXTINF:-1,All Access: Mayweather v Berto Part 1			
http://vod1.freeddns.org:80/1482511210/AllAccess1.mp4
#EXTINF:-1,All Access: Mayweather v Berto Part 2			
http://vod3.freeddns.org:80/151809610/Berto2.mp4
#EXTINF:-1,All Access: Mayweather v Berto Part 3			
http://vod3.freeddns.org:80/151809610/Berto3.mp4
#EXTINF:-1,All Elite Wrestling: Dark 03/12/19			
http://vod3.freeddns.org:80/195181173146/wwe/AEW-DARK-2019-12-03.mp4
#EXTINF:-1,All Elite Wrestling: Dark 05/11/19			
http://vod3.freeddns.org:80/195181173146/wwe/AEW-DARK-2019-11-05.mp4
#EXTINF:-1,All Elite Wrestling: Dark 07/01/20			
http://vod3.freeddns.org:80/195181173146/wwe/AEW-DARK-2020-01-07.mp4
#EXTINF:-1,All Elite Wrestling: Dark 08/10/19			
http://vod3.freeddns.org:80/195181173146/wwe/AEW-Dark-2019-10-08.mp4
#EXTINF:-1,All Elite Wrestling: Dark 08/11/19			
http://vod3.freeddns.org:80/195181173146/wwe/AEW-DARK-2019-11-08.mp4
#EXTINF:-1,All Elite Wrestling: Dark 10/12/19			
http://vod3.freeddns.org:80/195181173146/wwe/AEW-DARK-2019-12-10.mp4
#EXTINF:-1,All Elite Wrestling: Dark 14/01/20			
http://vod3.freeddns.org:80/195181173146/wwe/AEW-DARK-2020-01-14.mp4
#EXTINF:-1,All Elite Wrestling: Dark 15/10/19			
http://vod3.freeddns.org:80/195181173146/wwe/AEW-Dark-2019-10-15.mp4
#EXTINF:-1,All Elite Wrestling: Dark 17/12/19			
http://vod3.freeddns.org:80/195181173146/wwe/AEW-DARK-2019-12-17.mp4
#EXTINF:-1,All Elite Wrestling: Dark 19/11/19			
http://vod3.freeddns.org:80/195181173146/wwe/AEW-DARK-2019-11-19.mp4
#EXTINF:-1,All Elite Wrestling: Dark 21/01/20			
http://vod3.freeddns.org:80/195181173146/wwe/AEW-DARK-2020-01-21.mp4
#EXTINF:-1,All Elite Wrestling: Dark 22/10/19			
http://vod3.freeddns.org:80/195181173146/wwe/AEW-DARK-2019-10-22.mp4
#EXTINF:-1,All Elite Wrestling: Dark 24/12/19			
http://vod3.freeddns.org:80/195181173146/wwe/AEW-DARK-2019-12-24.mp4
#EXTINF:-1,All Elite Wrestling: Dark 26/11/19			
http://vod3.freeddns.org:80/195181173146/wwe/AEW-DARK-2019-11-26.mp4
#EXTINF:-1,All Elite Wrestling: Dark 28/01/20			
http://vod3.freeddns.org:80/195181173146/wwe/AEW-DARK-2020-01-28.mp4
#EXTINF:-1,All Elite Wrestling: Dark 29/10/19			
http://vod3.freeddns.org:80/195181173146/wwe/AEW-DARK-2019-10-29.mp4
#EXTINF:-1,All Elite Wrestling: Dynamite 01/01/20			
http://vod3.freeddns.org:80/195181173146/wwe/AEW-Dynamite-2020-01-01.mp4
#EXTINF:-1,All Elite Wrestling: Dynamite 02/10/19			
http://vod3.freeddns.org:80/195181173146/wwe/AEW-Dynamite-2019-10-02.mp4
#EXTINF:-1,All Elite Wrestling: Dynamite 04/12/19			
http://vod3.freeddns.org:80/195181173146/wwe/AEW-Dynamite-2019-12-04.mp4
#EXTINF:-1,All Elite Wrestling: Dynamite 05/02/20			
http://vod3.freeddns.org:80/195181173146/wwe/AEW-Dynamite-2020-02-05.mp4
#EXTINF:-1,All Elite Wrestling: Dynamite 06/11/19			
http://vod3.freeddns.org:80/195181173146/wwe/AEW-Dynamite-2019-11-06.mp4
#EXTINF:-1,All Elite Wrestling: Dynamite 08/01/20			
http://vod3.freeddns.org:80/195181173146/wwe/AEW-Dynamite-2020-01-08.mp4
#EXTINF:-1,All Elite Wrestling: Dynamite 09/10/19			
http://vod3.freeddns.org:80/195181173146/wwe/AEW-Dynamite-2019-10-09.mp4
#EXTINF:-1,All Elite Wrestling: Dynamite 11/12/19			
http://vod3.freeddns.org:80/195181173146/wwe/AEW-Dynamite-2019-12-11.mp4
#EXTINF:-1,All Elite Wrestling: Dynamite 13/11/19			
http://vod3.freeddns.org:80/195181173146/wwe/AEW-Dynamite-2019-11-13.mp4
#EXTINF:-1,All Elite Wrestling: Dynamite 15/01/20			
http://vod3.freeddns.org:80/195181173146/wwe/AEW-Dynamite-2020-01-15.mp4
#EXTINF:-1,All Elite Wrestling: Dynamite 16/10/19			
http://vod3.freeddns.org:80/195181173146/wwe/AEW-Dynamite-2019-10-16.mp4
#EXTINF:-1,All Elite Wrestling: Dynamite 18/12/19			
http://vod3.freeddns.org:80/195181173146/wwe/AEWDynamite-2019-12-18.mp4
#EXTINF:-1,All Elite Wrestling: Dynamite 20/11/19			
http://vod3.freeddns.org:80/195181173146/wwe/AEW-Dynamite-2019-11-20.mp4
#EXTINF:-1,All Elite Wrestling: Dynamite 22/01/20			
http://vod3.freeddns.org:80/195181173146/wwe/AEW-Dynamite-2020-01-22.mp4
#EXTINF:-1,All Elite Wrestling: Dynamite 23/10/19			
http://vod3.freeddns.org:80/195181173146/wwe/AEW-Dynamite-2019-10-23.mp4
#EXTINF:-1,All Elite Wrestling: Dynamite 25/12/19			
http://vod3.freeddns.org:80/195181173146/wwe/AEW-Dynamite-2019-12-25.mp4
#EXTINF:-1,All Elite Wrestling: Dynamite 27/11/19			
http://vod3.freeddns.org:80/195181173146/wwe/AEW-Dynamite-2019-11-27.mp4
#EXTINF:-1,All Elite Wrestling: Dynamite 29/01/20			
http://vod3.freeddns.org:80/195181173146/wwe/AEW-Dynamite-2020-01-29.mp4
#EXTINF:-1,All Elite Wrestling: Dynamite 30/10/19			
http://vod3.freeddns.org:80/195181173146/wwe/AEW-Dynamite-2019-10-30.mp4
#EXTINF:-1,All Girls Garage Season 8			
http://vod3.freeddns.org:80/145239129162/AllGirlsGarage-s08e01.mp4
#EXTINF:-1,All Girls Weekend			
http://vod3.freeddns.org:80/51254199141/allgirlsweekend.mp4
#EXTINF:-1,All Good Things			
http://vod3.freeddns.org:80/195181173146/movies/AllGoodThings.mp4
#EXTINF:-1,All In 2018			
http://vod3.freeddns.org:80/195181173146/wwe/AllIn-2018-09-01.mp4
#EXTINF:-1,All in All Azhagu Raja (Hindi)			
http://vod3.freeddns.org:80/217182132110/AllinAllAzhaguRaja.mp4
#EXTINF:-1,All Is True			
http://vod3.freeddns.org:80/14920266145/AllIsTrue-2018.mp4
#EXTINF:-1,All Night Season 1			
http://vod3.freeddns.org:80/145239129162/AllNight-s01e10.mp4
#EXTINF:-1,All Roads Lead to Rome			
http://vod3.freeddns.org:80/51254199141/allroadsleadtorome.mp4
#EXTINF:-1,All Round to Mrs Brown\s Season 1			
http://vod1.freeddns.org:80/1518018170/series/AllRoundToMrsBrowns-s01e06.mp4
#EXTINF:-1,All the Devil\s Men			
http://vod5.freeddns.org:80/95154195215/boxoffice2/AllTheDevilsMen-2018.mp4
#EXTINF:-1,All the King\s Men			
http://vod1.freeddns.org:80/519692115/AllTheKingsMen.mp4
#EXTINF:-1,All the Money in the World			
http://vod5.freeddns.org:80/95154195215/boxoffice/AllTheMoneyInTheWorld-2017.mp4
#EXTINF:-1,All the President\s Men			
http://vod3.freeddns.org:80/1492026922/PresMen.mp4
#EXTINF:-1,All the Right Moves			
http://vod3.freeddns.org:80/519682224/AllTheRightMoves.mp4
#EXTINF:-1,All the Way			
http://vod3.freeddns.org:80/14920271211/alltheway.mp4
#EXTINF:-1,All These Small Moments			
http://vod5.freeddns.org:80/95154195215/boxoffice2/All.These.Small.Moments.2018.720p.WEBRip.x264.mp4
#EXTINF:-1,Allahyar And The Legend Of Markhor (Urdu)			
http://vod3.freeddns.org:80/195181173146/AllahyarandtheLegendofMarkhor.mp4
#EXTINF:-1,Allied			
http://vod3.freeddns.org:80/51254199141/Allied.mp4
#EXTINF:-1,Almost Christmas			
http://vod3.freeddns.org:80/1492026922/AlmostChristmas.mp4
#EXTINF:-1,Almost Famous			
http://vod1.freeddns.org:80/519692115/almostfamous.mp4
#EXTINF:-1,Almost Never Season 1			
http://vod3.freeddns.org:80/195181173146/kids/AlmostNever-s01e13.mp4
#EXTINF:-1,Aloha			
http://vod3.freeddns.org:80/151809610/Aloha.mp4
#EXTINF:-1,Alone For Christmas			
http://vod3.freeddns.org:80/217182164138/AloneforChristmas.mp4
#EXTINF:-1,Alone in Berlin			
http://vod3.freeddns.org:80/14920271211/aloneinberlin.mp4
#EXTINF:-1,Alone With Her			
http://vod1.freeddns.org:80/519692115/AloneWithHer.mp4
#EXTINF:-1,Along Came a Spider			
http://vod1.freeddns.org:80/519692115/alongspider.mp4
#EXTINF:-1,Along Came Polly			
http://vod3.freeddns.org:80/1492028071/alongcamepolly.mp4
#EXTINF:-1,Along Came the Devil			
http://vod5.freeddns.org:80/95154195215/boxoffice2/AlongCametheDevil-2018.mp4
#EXTINF:-1,Alpha			
http://vod5.freeddns.org:80/95154195215/boxoffice2/Alpha-2018.mp4
#EXTINF:-1,Alpha and Omega: The Big Fureeze			
http://vod3.freeddns.org:80/1492026922/alphaomegafureeze.mp4
#EXTINF:-1,Already Gone			
http://vod3.freeddns.org:80/14920266145/AlreadyGone.mp4
#EXTINF:-1,Already Tomorrow in Hong Kong			
http://vod3.freeddns.org:80/151809784/AlreadyTomorrowinHongKong.mp4
#EXTINF:-1,Altar			
http://vod3.freeddns.org:80/151809610/Altar.mp4
#EXTINF:-1,Alternate Endings: Six New Ways to Die in America			
http://vod3.freeddns.org:80/195181173146/Alternate.Endings.Six.New.Ways.to.Die.in.America.2019.720p.AMZN.WEB-DL.DDP5.1.H.264-NTG.mp4
#EXTINF:-1,Alvin and the Chipmunks: The Road Chip			
http://vod3.freeddns.org:80/51254199141/alvin.mp4
#EXTINF:-1,Always - Sunset on Third Street 3			
http://vod3.freeddns.org:80/195181173146/Always.Sunset.on.Third.Street.3.2012.JAPANESE.1080p.BluRay.H264.AAC-VXT.mp4
#EXTINF:-1,Always Be My Maybe			
http://vod3.freeddns.org:80/14920266145/AlwaysBeMyMaybe-2019.mp4
#EXTINF:-1,Always Watching: A Marble Hornets Story			
http://vod3.freeddns.org:80/217182172100/AlwaysWatching.mp4
#EXTINF:-1,Amadeus			
http://vod3.freeddns.org:80/195181164146/Amadeus.mp4
#EXTINF:-1,Amar Akbar Anthony			
http://vod3.freeddns.org:80/195181173146/AmarAkbarAnthony.mp4
#EXTINF:-1,Amavas			
http://vod3.freeddns.org:80/195181173146/Amavas.mp4
#EXTINF:-1,Amazing Journey: The Story of The Who			
http://vod1.freeddns.org:80/519692115/WhoStory.mp4
#EXTINF:-1,Amazon Obhijaan			
http://vod3.freeddns.org:80/195181173146/AmazonObhijaan.mp4
#EXTINF:-1,Amelia 2.0			
http://vod3.freeddns.org:80/1492026922/Amelia2.mp4
#EXTINF:-1,America\s Next Top Model Season 24			
http://vod3.freeddns.org:80/195181164146/series/AmericasNextTopModel-S24E14.mp4
#EXTINF:-1,America\s Planned War on Britain			
http://vod1.freeddns.org:80/519692115/USAUK.mp4
#EXTINF:-1,America\s War on Drugs			
http://vod3.freeddns.org:80/1492026922/series/WaronDrugs-s01e04.mp4
#EXTINF:-1,American Assassin			
http://vod1.freeddns.org:80/14920220391/AmericanAssassin.mp4
#EXTINF:-1,American Beauty Star Season 2			
http://vod3.freeddns.org:80/145239129162/AmericanBeautyStar-s02e13.mp4
#EXTINF:-1,American Buffalo			
http://vod3.freeddns.org:80/519682224/AmericanBuffalo-1996.mp4
#EXTINF:-1,American Chopper Season 11			
http://vod3.freeddns.org:80/145239129162/AmericanChopper-s11e08.mp4
#EXTINF:-1,American Chopper Season 12			
http://vod3.freeddns.org:80/145239129162/AmericanChopper-s12e06.mp4
#EXTINF:-1,American Dream/American Knightmare			
http://vod3.freeddns.org:80/195181173146/American.Dream.American.Knightmare.2018.720p.WEBRip.x264.mp4
#EXTINF:-1,American Dresser			
http://vod5.freeddns.org:80/95154195215/boxoffice2/AmericanDresser-2018.mp4
#EXTINF:-1,American Exorcism			
http://vod3.freeddns.org:80/1492028071/AmericanExorcism.mp4
#EXTINF:-1,American Factory			
http://vod3.freeddns.org:80/195181173146/American.Factory.2019.1080p.WEBRip.x264-RARBG.mp4
#EXTINF:-1,American Gangster			
http://vod3.freeddns.org:80/195181164146/AmericanGangster.mp4
#EXTINF:-1,American Gothic			
http://vod1.freeddns.org:80/1482511210/AmericanGothic.mp4
#EXTINF:-1,American Gothic 2017			
http://vod3.freeddns.org:80/195181164146/AmericanGothic2017.mp4
#EXTINF:-1,American Graffiti			
http://vod3.freeddns.org:80/1492026922/AmericanGraffiti.mp4
#EXTINF:-1,American Hangman			
http://vod3.freeddns.org:80/1492028071/AmericanHangman.mp4
#EXTINF:-1,American Heist			
http://vod3.freeddns.org:80/151809610/AmericanHeist.mp4
#EXTINF:-1,American History X			
http://vod3.freeddns.org:80/195181164146/AmericanHistoryX.mp4
#EXTINF:-1,American Honey			
http://vod3.freeddns.org:80/51254199141/AmericanHoney.mp4
#EXTINF:-1,American Hustle			
http://vod1.freeddns.org:80/13774202158/Hustle.mp4
#EXTINF:-1,American Made			
http://vod3.freeddns.org:80/195181164146/AmericanMade2017.mp4
#EXTINF:-1,American Music Awards 2016			
http://vod1.freeddns.org:80/148251187141/AMAs.mp4
#EXTINF:-1,American Odyssey Season 1			
http://vod3.freeddns.org:80/195181164146/series/AmericanOdyssey-s01e13.mp4
#EXTINF:-1,American Pie 2			
http://vod3.freeddns.org:80/217182172100/AmericanPie2.mp4
#EXTINF:-1,American Pie 3 - The Wedding			
http://vod3.freeddns.org:80/217182172100/AmericanPie3-TheWedding.mp4
#EXTINF:-1,American Pie 4 - Reunion			
http://vod3.freeddns.org:80/217182172100/AmericanPie4-TheReunion.mp4
#EXTINF:-1,American Pie 5 - Band Camp			
http://vod3.freeddns.org:80/217182172100/AmericanPie5-BandCamp.mp4
#EXTINF:-1,American Pie 6 - The Naked Mile			
http://vod3.freeddns.org:80/217182172100/AmericanPie6-TheNakedMile.mp4
#EXTINF:-1,American Pie 7 - Beta House			
http://vod3.freeddns.org:80/217182172100/AmericanPie7-BetaHouse.mp4
#EXTINF:-1,American Psycho			
http://vod3.freeddns.org:80/217182172100/AmericanPsycho.mp4
#EXTINF:-1,American Ripper			
http://vod3.freeddns.org:80/1492026922/series/AmericanRipper-s01e08.mp4
#EXTINF:-1,American Son			
http://vod3.freeddns.org:80/14920266145/American.Son.2019.720p.NF.WEB-DL.DDP5.1.x264-NTG.mp4
#EXTINF:-1,American Ultra			
http://vod3.freeddns.org:80/217182172100/AmericanUltra.mp4
#EXTINF:-1,American Violence			
http://vod3.freeddns.org:80/51254199141/AmericanViolence.mp4
#EXTINF:-1,American Woman			
http://vod1.freeddns.org:80/95154195215h/movies/AmericanWoman-2018.mp4
#EXTINF:-1,American: The Bill Hicks Story			
http://vod1.freeddns.org:80/519692115/BillHicks-TheBillHicksStory.mp4
#EXTINF:-1,AmeriGeddon			
http://vod1.freeddns.org:80/1518018170/AmeriGeddon.mp4
#EXTINF:-1,Amir Khan v Chris Algieri 29/05/15			
http://vod1.freeddns.org:80/1482511210/KhanAlgieri.mp4
#EXTINF:-1,Amir Khan vs Devon Alexander Boxing 23th Dec Las Vegas			
http://vod1.freeddns.org:80/13774202158/Khan.mp4
#EXTINF:-1,Amityville 3			
http://vod3.freeddns.org:80/195181164146/Amityville3.mp4
#EXTINF:-1,Amityville II: The Possession			
http://vod3.freeddns.org:80/195181164146/Amityville2.mp4
#EXTINF:-1,Amityville: A New Generation			
http://vod3.freeddns.org:80/195181164146/Amityville7.mp4
#EXTINF:-1,Amityville: Dollhouse			
http://vod3.freeddns.org:80/195181164146/Amityville8.mp4
#EXTINF:-1,Amityville: It\s About Time			
http://vod3.freeddns.org:80/195181164146/Amityville6.mp4
#EXTINF:-1,Amityville: The Awakening			
http://vod3.freeddns.org:80/195181164146/AmityvilleTheAwakening.mp4
#EXTINF:-1,Amityville: The Evil Escapes			
http://vod3.freeddns.org:80/195181164146/Amityville4.mp4
#EXTINF:-1,Amores perros			
http://vod1.freeddns.org:80/148251187141/AmoresPerros.mp4
#EXTINF:-1,Amundsen			
http://vod3.freeddns.org:80/195181173146/Amundsen.2019.NORWEGIAN.1080p.BluRay.H264.AAC-VXT.mp4
#EXTINF:-1,Amy			
http://vod3.freeddns.org:80/217182172100/Amy.mp4
#EXTINF:-1,An Actor Prepares			
http://vod5.freeddns.org:80/95154195215/boxoffice2/AnActorPrepares-2018.mp4
#EXTINF:-1,An Affair to Remember			
http://vod3.freeddns.org:80/51254199141/AnAffairToRemember.mp4
#EXTINF:-1,An American Girl Story - Ivy & Julie 1976: A Happy Balance			
http://vod1.freeddns.org:80/1518018170/AnAmericanGirlStory-IvyAndJulie1976.mp4
#EXTINF:-1,An American Haunting			
http://vod1.freeddns.org:80/519692115/AnAmericanHaunting.mp4
#EXTINF:-1,An American Tail			
http://vod3.freeddns.org:80/1492028071/AnAmericanTail.mp4
#EXTINF:-1,An American Werewolf in London			
http://vod3.freeddns.org:80/1492028071/americanwerewolf.mp4
#EXTINF:-1,An Education			
http://vod3.freeddns.org:80/217182172100/AnEducation.mp4
#EXTINF:-1,An Elf\s Story			
http://vod3.freeddns.org:80/195181173146/movies/AnElfsStory-2011.mp4
#EXTINF:-1,An Evening with Beverly Luff Linn			
http://vod5.freeddns.org:80/95154195215/boxoffice2/AnEveningWithBeverlyLuffLinn-2018.mp4
#EXTINF:-1,An Interview with God			
http://vod3.freeddns.org:80/14920266145/AnInterviewWithGod-2018.mp4
#EXTINF:-1,An Officer and a Gentleman			
http://vod3.freeddns.org:80/195181164146/officer.mp4
#EXTINF:-1,Ana			
http://vod3.freeddns.org:80/14920266145/Ana-2019.mp4
#EXTINF:-1,Anand			
http://vod3.freeddns.org:80/217182172100/Anand.mp4
#EXTINF:-1,Anandi Gopal			
http://vod3.freeddns.org:80/195181173146/AnandiGopal.mp4
#EXTINF:-1,Anatomy of a Murder			
http://vod3.freeddns.org:80/195181173146/Anatomy.Of.A.Murder.1959.720p.BluRay.x264.mp4
#EXTINF:-1,Anchorman 2: The Legend Continues			
http://vod1.freeddns.org:80/13774202158/Anch2.mp4
#EXTINF:-1,Anchorman: The Legend of Ron Burgundy			
http://vod3.freeddns.org:80/217182172100/Anchor.mp4
#EXTINF:-1,And So It Goes			
http://vod3.freeddns.org:80/217182172100/AndSoIt.mp4
#EXTINF:-1,And the Band Played On			
http://vod3.freeddns.org:80/519682224/AndTheBandPlayedOn.mp4
#EXTINF:-1,Andaz Apna Apna			
http://vod1.freeddns.org:80/1518018170/AndazApnaApna.mp4
#EXTINF:-1,Andhadhun			
http://vod5.freeddns.org:80/95154195215/boxoffice2/Andhadhun.mp4
#EXTINF:-1,Andover			
http://vod5.freeddns.org:80/95154195215/boxoffice/Andover.mp4
#EXTINF:-1,Andre the Giant			
http://vod1.freeddns.org:80/14523911226/AndreTheGiant.mp4
#EXTINF:-1,Andre Ward vs Sullivan Barrera 27/03/16			
http://vod1.freeddns.org:80/1518018170/wardbar.mp4
#EXTINF:-1,Angel Has Fallen			
http://vod3.freeddns.org:80/14920266145/AngelHasFallen-2019.mp4
#EXTINF:-1,Angel Heart			
http://vod3.freeddns.org:80/195181164146/AngelHeart.mp4

#EXTINF:-1,Anti Matter (HDRip)			
http://vod3.freeddns.org:80/51254199141/AntiMatter.mp4
#EXTINF:-1,Antichrist			
http://vod1.freeddns.org:80/519692115/Antichrist.mp4
#EXTINF:-1,Antwone Fisher			
http://vod3.freeddns.org:80/195181173146/Antwone.Fisher.2002.720p.BluRay.x264.mp4
#EXTINF:-1,Antz			
http://vod3.freeddns.org:80/217182172100/antz.mp4
#EXTINF:-1,Anvil: The Story of Anvil			
http://vod3.freeddns.org:80/195181164146/Anvil.mp4
#EXTINF:-1,Any Body Can Dance 2			
http://vod3.freeddns.org:80/217182172100/ABCD2.mp4
#EXTINF:-1,Any Given Sunday			
http://vod3.freeddns.org:80/14920271211/anygivensunday.mp4
#EXTINF:-1,Any Which Way You Can			
http://vod3.freeddns.org:80/195181173146/movies/AnyWhichWayYouCan-1980.mp4
#EXTINF:-1,Apaharan			
http://vod3.freeddns.org:80/51254199141/Apaharan.mp4
#EXTINF:-1,APEX: The Secret Race Across America			
http://vod3.freeddns.org:80/195181173146/APEX.The.Secret.Race.Across.America.2019.WEBRip.x264-ION10.mp4
#EXTINF:-1,Apocalypto			
http://vod1.freeddns.org:80/519692115/apoc.mp4
#EXTINF:-1,Apollo 11			
http://vod3.freeddns.org:80/195181173146/Apollo.11.2019.720p.BluRay.H264.AAC-RARBG.mp4
#EXTINF:-1,Apostle			
http://vod5.freeddns.org:80/95154195215/boxoffice2/Apostle-2018.mp4
#EXTINF:-1,Aquamarine			
http://vod3.freeddns.org:80/151809784/Aquamarine.mp4
#EXTINF:-1,Arachnophobia			
http://vod3.freeddns.org:80/195181173146/movies/Arachnophobia-1990.mp4
#EXTINF:-1,Aramm (Dual Audio)			
http://vod3.freeddns.org:80/195181173146/Aramm.mp4
#EXTINF:-1,Aranyaka			
http://vod5.freeddns.org:80/95154195215/boxoffice/Aranyaka.mp4
#EXTINF:-1,Arctic			
http://vod3.freeddns.org:80/14920266145/Arctic-2018.mp4
#EXTINF:-1,Arctic Live			
http://vod3.freeddns.org:80/1492028071/arcticlive-s01e02.mp4
#EXTINF:-1,Ardaas (Punjabi)			
http://vod3.freeddns.org:80/51254199141/Ardaas.mp4
#EXTINF:-1,Ardh Satya			
http://vod3.freeddns.org:80/1492026922/ArdhSatya.mp4
#EXTINF:-1,Are We Done Yet?			
http://vod1.freeddns.org:80/519692115/AreWeDoneYet.mp4
#EXTINF:-1,Area 51			
http://vod1.freeddns.org:80/1482511210/Area51.mp4
#EXTINF:-1,Argo			
http://vod3.freeddns.org:80/195181164146/Argo.mp4
#EXTINF:-1,Arizona			
http://vod5.freeddns.org:80/95154195215/boxoffice/Arizona-2018.mp4
#EXTINF:-1,Arjun Patiala			
http://vod3.freeddns.org:80/195181173146/ArjunPatiala.mp4
#EXTINF:-1,Arjun Reddy			
http://vod3.freeddns.org:80/195181173146/ArjunReddy.mp4
#EXTINF:-1,Arjun Reddy (Telugu)			
http://vod3.freeddns.org:80/195181164146/ArjunReddy.mp4
#EXTINF:-1,Armed			
http://vod5.freeddns.org:80/95154195215/boxoffice2/Armed-2018.mp4
#EXTINF:-1,Armed Response			
http://vod3.freeddns.org:80/519682224/armedresponse.mp4
#EXTINF:-1,Armored			
http://vod1.freeddns.org:80/519692115/Armored.mp4
#EXTINF:-1,Armstrong			
http://vod3.freeddns.org:80/195181173146/docs/Armstrong-2019.mp4
#EXTINF:-1,Army of One			
http://vod3.freeddns.org:80/1492028071/ArmyofOne.mp4
#EXTINF:-1,Army: Behind the New Frontlines			
http://vod3.freeddns.org:80/195181164146/series/Army-S01E03.mp4
#EXTINF:-1,Around the World in 80 Days (1956)			
http://vod3.freeddns.org:80/519682224/AroundTheWorldIn80Days-1956.mp4
#EXTINF:-1,Around the World in 80 Days (2004)			
http://vod3.freeddns.org:80/519682224/AroundTheWorldIn80Days-2004.mp4
#EXTINF:-1,Arsenal			
http://vod3.freeddns.org:80/195181164146/Arsenal2017.mp4
#EXTINF:-1,Arsenal vs Liverpool 23/12/17			
http://vod1.freeddns.org:80/14523911226/footy/EPL201718-ArsenalLiverpool-s01e02.mp4
#EXTINF:-1,Art School Confidential			
http://vod1.freeddns.org:80/519692115/ArtSchoolConfidential.mp4
#EXTINF:-1,Arthur & George Season 1			
http://vod1.freeddns.org:80/148251187141/series/arthurandgeorge-s01e03.mp4
#EXTINF:-1,Arthur Abraham vs Martin Murray +Darleys Perez vs Anthony Crolla  2 - 22/11/15			
http://vod3.freeddns.org:80/217182172100/AACrolla.mp4
#EXTINF:-1,Article 15			
http://vod3.freeddns.org:80/195181173146/Article15.mp4
#EXTINF:-1,Aruvi (Tamil) (English Subs)			
http://vod1.freeddns.org:80/14920220391/Aruvi.mp4
#EXTINF:-1,Ascharya F**k It			
http://vod3.freeddns.org:80/195181173146/AscharyaFuckIt.mp4
#EXTINF:-1,Asees (Punjabi)			
http://vod3.freeddns.org:80/195181173146/Asees.mp4
#EXTINF:-1,Ash Is Purest White			
http://vod3.freeddns.org:80/195181173146/Jiang.hu.er.nv2018.HD.1080P.X264.ACC.CHS-BTshoufa.mp4
#EXTINF:-1,Ashes in the Snow			
http://vod5.freeddns.org:80/95154195215/boxoffice2/AshesInTheSnow-2018.mp4
#EXTINF:-1,Assimilate			
http://vod3.freeddns.org:80/14920266145/Assimilate-720p.mp4
#EXTINF:-1,Astro Kid			
http://vod3.freeddns.org:80/14920266145/AstroKid.mp4
#EXTINF:-1,Astronaut			
http://vod3.freeddns.org:80/14920266145/Astronaut.2019.720p.WEB-DL.XviD.AC3-FGT.mp4
#EXTINF:-1,Astronauts Do You Have What It Takes			
http://vod3.freeddns.org:80/195181164146/astrotakes-s01e06.mp4
#EXTINF:-1,At Eternity\s Gate			
http://vod3.freeddns.org:80/145239129162/old0619/AtEternitysGate-2018.mp4
#EXTINF:-1,At First Light			
http://vod5.freeddns.org:80/95154195215/boxoffice2/AtFirstLight-2018.mp4
#EXTINF:-1,At Last: Mayweather v Pacquiao			
http://vod1.freeddns.org:80/148251187141/AtLast.mp4
#EXTINF:-1,At the Heart of Gold: Inside the USA Gymnastics Scandal			
http://vod3.freeddns.org:80/195181173146/At.the.Heart.of.Gold.Inside.the.USA.Gymnastics.Scandal.2019.720p.AMZN.WEB-DL.DDP5.1.H.264-NTG.mp4
#EXTINF:-1,Atlantic City			
http://vod3.freeddns.org:80/195181173146/Atlantic.City.1980.720p.BluRay.x264.mp4
#EXTINF:-1,Atlantic Rim: Resurrection			
http://vod1.freeddns.org:80/519692115/AtlanticRim-2-Resurrection.mp4
#EXTINF:-1,Atlantis: The Lost Empire			
http://vod3.freeddns.org:80/195181173146/Atlantis.The.Lost.Empire.2001.720p.BRrip.x264.GAZ.YIFY.mp4
#EXTINF:-1,Atomic Blonde			
http://vod3.freeddns.org:80/217182132110/AtomicBlonde.mp4
#EXTINF:-1,Atonement			
http://vod3.freeddns.org:80/1492028071/Atonement.mp4
#EXTINF:-1,Attack of the Puppet People			
http://vod3.freeddns.org:80/195181164146/AttackOfThePuppetPeople.mp4
#EXTINF:-1,Attenborough and the Giant Dinosaur			
http://vod1.freeddns.org:80/519692115/giantdino1.mp4
#EXTINF:-1,Attenborough And The Giant Elephant			
http://vod3.freeddns.org:80/195181164146/giantelephant.mp4
#EXTINF:-1,Attenborough at 90			
http://vod3.freeddns.org:80/14920271211/att90.mp4
#EXTINF:-1,Attenborough\s Life That Glows			
http://vod3.freeddns.org:80/1492028071/attglow1.mp4
#EXTINF:-1,Attila			
http://vod3.freeddns.org:80/195181173146/movies/Attila-2001.mp4
#EXTINF:-1,Attrition			
http://vod3.freeddns.org:80/14920266145/Attrition-2018.mp4
#EXTINF:-1,August Rush			
http://vod3.freeddns.org:80/51254199141/augustrush.mp4
#EXTINF:-1,Aurangzeb			
http://vod3.freeddns.org:80/51254199141/Aurangzeb.mp4
#EXTINF:-1,Aurora			
http://vod3.freeddns.org:80/14920266145/Aurora.mp4
#EXTINF:-1,Austin Powers: International Man of Mystery			
http://vod3.freeddns.org:80/217182172100/AP1.mp4
#EXTINF:-1,Austin Powers: The Spy Who Shagged Me			
http://vod3.freeddns.org:80/217182172100/AP2.mp4
#EXTINF:-1,Australia Day			
http://vod3.freeddns.org:80/195181164146/australiaday.mp4
#EXTINF:-1,Australian Open Highlights 27/01/17			
http://vod1.freeddns.org:80/1518018170/ozopen.mp4
#EXTINF:-1,Autómata			
http://vod1.freeddns.org:80/148251187141/AutoM.mp4
#EXTINF:-1,Authors Anonymous			
http://vod3.freeddns.org:80/1492026922/authors.mp4
#EXTINF:-1,Autism: Challenging Behaviour			
http://vod3.freeddns.org:80/1492026922/autismchallenging.mp4
#EXTINF:-1,Autohead			
http://vod3.freeddns.org:80/195181173146/Autohead.mp4
#EXTINF:-1,Aval (Tamil) (English Subs)			
http://vod3.freeddns.org:80/195181164146/Aval.mp4
#EXTINF:-1,Avanti!			
http://vod3.freeddns.org:80/195181173146/Avanti!.1972.720p.BluRay.x264.mp4
#EXTINF:-1,Avatar (3D)			
http://vod3.freeddns.org:80/151809610/Avatar3D.mp4
#EXTINF:-1,Avengement			
http://vod3.freeddns.org:80/14920266145/Avengement-2019.mp4
#EXTINF:-1,Avengers: Age of Ultron			
http://vod3.freeddns.org:80/151809610/Ultron.mp4
#EXTINF:-1,Avengers: Age of Ultron (3D)			
http://vod3.freeddns.org:80/151809610/Ultron3D.mp4
#EXTINF:-1,Avengers: Age of Ultron (English subs)			
http://vod3.freeddns.org:80/1492028071/UltronSub.mp4
#EXTINF:-1,Avicii: True Stories			
http://vod5.freeddns.org:80/95154195215/boxoffice/Avicii.True.Stories.2017.720p.WEBRip.x264.mp4
#EXTINF:-1,Await Further Instructions			
http://vod5.freeddns.org:80/95154195215/boxoffice2/AwaitFurtherInstructions-2018.mp4
#EXTINF:-1,Awake			
http://vod3.freeddns.org:80/14920266145/Awake-2019.mp4
#EXTINF:-1,Awaken the Shadowman			
http://vod3.freeddns.org:80/1492028071/AwakentheShadowman.mp4
#EXTINF:-1,Aynabaji (Bangla)			
http://vod3.freeddns.org:80/51254199141/Aynabaji.mp4
#EXTINF:-1,Azhar			
http://vod3.freeddns.org:80/1492028071/Azhar.mp4
#EXTINF:-1,Aziz Ansari: RIGHT NOW			
http://vod3.freeddns.org:80/195181173146/Aziz.Ansari.Right.Now.2019.720p.WEB.X264-AMRAP.mp4
#EXTINF:-1,B.A. Pass			
http://vod3.freeddns.org:80/51254199141/BAPass.mp4
#EXTINF:-1,Bænken (Swedish Subs)			
http://vod3.freeddns.org:80/217182164125/Banken.mp4
#EXTINF:-1,Bølgen (The Wave) (English Subs)			
http://vod3.freeddns.org:80/195181164146/TheWave.mp4
#EXTINF:-1,Baabul			
http://vod3.freeddns.org:80/51254199141/Baabul.mp4
#EXTINF:-1,Baadshaho			
http://vod1.freeddns.org:80/14920220391/Baadshaho.mp4
#EXTINF:-1,Baaghi			
http://vod1.freeddns.org:80/1518018170/Baaghi.mp4
#EXTINF:-1,Baahubali 2: The Conclusion			
http://vod3.freeddns.org:80/51254199141/Baahubali2.mp4
#EXTINF:-1,Baar Baar Dekho			
http://vod3.freeddns.org:80/51254199141/Baar.mp4
#EXTINF:-1,Baazaar			
http://vod3.freeddns.org:80/195181173146/Baazaar.mp4
#EXTINF:-1,Baazigar			
http://vod3.freeddns.org:80/51254199141/Baazigar.mp4
#EXTINF:-1,Babe			
http://vod3.freeddns.org:80/195181164146/Babe.mp4
#EXTINF:-1,Babel			
http://vod1.freeddns.org:80/519692115/Babel.mp4
#EXTINF:-1,Babur Biye (Bengali)			
http://vod3.freeddns.org:80/195181173146/BaburBiye.mp4
#EXTINF:-1,Baby			
http://vod3.freeddns.org:80/151809610/Baby.mp4
#EXTINF:-1,Baby Mama			
http://vod3.freeddns.org:80/519682224/BabyMana.mp4
#EXTINF:-1,Babysitting 2			
http://vod1.freeddns.org:80/519692115/Babysitting2.mp4
#EXTINF:-1,Baccha Shoshur (Bengali)			
http://vod3.freeddns.org:80/195181173146/BacchaShoshur.mp4
#EXTINF:-1,Bachelor Party			
http://vod3.freeddns.org:80/519682224/BachelorParty.mp4
#EXTINF:-1,Back at the Barnyard When No One\s Looking			
http://vod3.freeddns.org:80/217182172100/barnyard2.mp4
#EXTINF:-1,Back in Time			
http://vod1.freeddns.org:80/519692115/BackInTime.mp4
#EXTINF:-1,Back Roads			
http://vod3.freeddns.org:80/145239129162/old0619/Back.Roads.2018.720p.WEBRip.x264.mp4
#EXTINF:-1,Back Season 1			
http://vod3.freeddns.org:80/195181164146/series/Back-s01e06.mp4
#EXTINF:-1,Back to Berlin			
http://vod3.freeddns.org:80/195181173146/Back.to.Berlin.2018.1080p.WEBRip.x264-RARBG.mp4
#EXTINF:-1,Back with the Ex Season 1			
http://vod3.freeddns.org:80/145239129162/BackWithTheEx-s01e07.mp4
#EXTINF:-1,Backcountry			
http://vod3.freeddns.org:80/151809610/Backcountry.mp4
#EXTINF:-1,Backdraft			
http://vod3.freeddns.org:80/51254199141/Backdraft.mp4
#EXTINF:-1,Backstabbing for Beginners			
http://vod5.freeddns.org:80/95154195215/boxoffice/BackstabbingForBeginners-2018.mp4
#EXTINF:-1,Backtrace			
http://vod3.freeddns.org:80/145239129162/old0619/Backtrace-2018.mp4
#EXTINF:-1,Backtrack			
http://vod3.freeddns.org:80/1492028071/backtrack.mp4
#EXTINF:-1,Bad Boys			
http://vod3.freeddns.org:80/145239129162/old0619/badboys.mp4
#EXTINF:-1,Bad Boys II			
http://vod3.freeddns.org:80/145239129162/old0619/badboys2.mp4
#EXTINF:-1,Bad Day at Black Rock			
http://vod3.freeddns.org:80/195181173146/movies/BadDayAtBlackRock-1955.mp4
#EXTINF:-1,Bad Guys Always Die			
http://vod1.freeddns.org:80/519692115/BadGuysAlwaysDie.mp4
#EXTINF:-1,Bad Lieutenant			
http://vod3.freeddns.org:80/1492028071/BadLieutenant.mp4
#EXTINF:-1,Bad Match			
http://vod3.freeddns.org:80/217182164125/BadMatch.mp4
#EXTINF:-1,Bad Moms			
http://vod3.freeddns.org:80/14920271211/badmoms.mp4
#EXTINF:-1,Bad Neighbors			
http://vod3.freeddns.org:80/195181164146/BadNeighbors.mp4
#EXTINF:-1,Bad Neighbours			
http://vod3.freeddns.org:80/217182172100/neighbours1.mp4
#EXTINF:-1,Bad Samaritan			
http://vod5.freeddns.org:80/95154195215/boxoffice/BadSamaritan.mp4
#EXTINF:-1,Bad Santa			
http://vod1.freeddns.org:80/519692115/BadSanta.mp4
#EXTINF:-1,Bad Teacher			
http://vod3.freeddns.org:80/195181164146/badteacher.mp4
#EXTINF:-1,Badge of Honor			
http://vod3.freeddns.org:80/217182172100/badgeofhonor.mp4
#EXTINF:-1,Badla			
http://vod3.freeddns.org:80/195181173146/Badla.mp4
#EXTINF:-1,Badlapur			
http://vod1.freeddns.org:80/519692115/Badlapur.mp4
#EXTINF:-1,Badmaash Bubbly			
http://vod3.freeddns.org:80/195181173146/BadmaashBubbly.mp4
#EXTINF:-1,Badman			
http://vod5.freeddns.org:80/95154195215/boxoffice/Badman.mp4
#EXTINF:-1,Badou Jack vs Lucian Bute 30/04/16			
http://vod3.freeddns.org:80/1492028071/jackbute.mp4
#EXTINF:-1,Badrinath Ki Dulhania			
http://vod3.freeddns.org:80/51254199141/BadrinathKiDulhania.mp4
#EXTINF:-1,Bah			
http://vod3.freeddns.org:80/5125579157/Bah.Humduck!.A.Looney.Tunes.Christmas.2006.720p.WEBRip.x264.mp4
#EXTINF:-1,Bairavaa (Hindi)			
http://vod3.freeddns.org:80/519682224/Bairavaa.mp4
#EXTINF:-1,Bairavaa (Tamil)			
http://vod3.freeddns.org:80/51254199141/Bairavaa.mp4
#EXTINF:-1,Bait			
http://vod3.freeddns.org:80/195181173146/movies/Bait-2012.mp4
#EXTINF:-1,Bait (2014)			
http://vod3.freeddns.org:80/195181173146/movies/Bait-2014.mp4
#EXTINF:-1,Bajirao Ek Yodha			
http://vod1.freeddns.org:80/519692115/Bajirao.mp4
#EXTINF:-1,Bajirao Mastani			
http://vod3.freeddns.org:80/1492026922/BajiraoMastani.mp4
#EXTINF:-1,Bajrangi Bhaijaan			
http://vod1.freeddns.org:80/519692115/BajrangiBhaijaan.mp4
#EXTINF:-1,Baked in Brooklyn			
http://vod3.freeddns.org:80/51254199141/BakedinBrooklyn.mp4
#EXTINF:-1,Balakrishnudu			
http://vod3.freeddns.org:80/195181173146/Balakrishnudu.mp4
#EXTINF:-1,Balboa Blvd			
http://vod3.freeddns.org:80/14920266145/BalboaBlvd.mp4
#EXTINF:-1,Ballad in Blue			
http://vod3.freeddns.org:80/195181173146/Ballad.In.Blue.1965.720p.BluRay.x264.mp4
#EXTINF:-1,Ballerina			
http://vod3.freeddns.org:80/1492028071/Ballerina.mp4
#EXTINF:-1,Balls of Fury			
http://vod3.freeddns.org:80/145239129162/BallsofFury.mp4
#EXTINF:-1,Balls Out			
http://vod3.freeddns.org:80/1492026922/ballsout.mp4
#EXTINF:-1,Balto			
http://vod3.freeddns.org:80/195181173146/Balto.1995.720p.BRrip.x264.GAZ.YIFY.mp4
#EXTINF:-1,Balto II: Wolf Quest			
http://vod3.freeddns.org:80/195181173146/Balto.II.Wolf.Quest.2002.720p.BRrip.x264.GAZ.YIFY.mp4
#EXTINF:-1,Balto III: Wings of Change			
http://vod3.freeddns.org:80/195181173146/Balto.III.Wings.of.Change.2004.720p.BRrip.x264.GAZ.YIFY.mp4
#EXTINF:-1,Bambi			
http://vod3.freeddns.org:80/195181164146/Bambi.mp4
#EXTINF:-1,Bambukat (Punjabi)			
http://vod3.freeddns.org:80/51254199141/Bambukat.mp4
#EXTINF:-1,Band Aid			
http://vod3.freeddns.org:80/195181164146/bandaid.mp4
#EXTINF:-1,Band of Brothers Documentary			
http://vod1.freeddns.org:80/13774202158/BandDoc.mp4
#EXTINF:-1,Band of Robbers			
http://vod3.freeddns.org:80/51254199141/BandofRobbers.mp4
#EXTINF:-1,Band of the Hand			
http://vod3.freeddns.org:80/51254199141/BandOfTheHand.mp4
#EXTINF:-1,Bandishala			
http://vod3.freeddns.org:80/195181173146/Bandishala.mp4
#EXTINF:-1,Bang Bang			
http://vod3.freeddns.org:80/151809610/BangBang.mp4
#EXTINF:-1,Bangistan			
http://vod1.freeddns.org:80/519692115/Bangistan.mp4
#EXTINF:-1,Bangkok Dangerous			
http://vod1.freeddns.org:80/519692115/BangkokDangerous.mp4
#EXTINF:-1,Banjo			
http://vod3.freeddns.org:80/1492028071/Banjo.mp4
#EXTINF:-1,Bank Chor			
http://vod3.freeddns.org:80/51254199141/BankChor.mp4
#EXTINF:-1,Banking on Bitcoin			
http://vod3.freeddns.org:80/1492026922/bankingonbitcoin.mp4
#EXTINF:-1,Barbarella			
http://vod3.freeddns.org:80/151809784/Barbarella.mp4
#EXTINF:-1,Barbershop			
http://vod1.freeddns.org:80/519692115/Barbershop1.mp4
#EXTINF:-1,Barbie: Star Light Adventure			
http://vod3.freeddns.org:80/1492028071/barbiestar.mp4
#EXTINF:-1,Bard of Blood			
http://vod3.freeddns.org:80/195181173146/BardofBloodS1.mp4
#EXTINF:-1,Bare Knuckle Fighting Championship 6			
http://vod3.freeddns.org:80/145239129162/BKFC6.mp4
#EXTINF:-1,Barefoot in the Park			
http://vod3.freeddns.org:80/151809784/BarefootInThePark.mp4
#EXTINF:-1,Bareilly Ki Barfi			
http://vod3.freeddns.org:80/195181164146/BareillyKiBarfi.mp4
#EXTINF:-1,Barely Lethal			
http://vod3.freeddns.org:80/151809610/BarelyLethal.mp4
#EXTINF:-1,Barfi!			
http://vod3.freeddns.org:80/151809610/Barfi.mp4
#EXTINF:-1,Bargain Loving Brits in the Sun Season 1			
http://vod3.freeddns.org:80/1518026228/series/BargainLovingBritsInTheSun-s01e08.mp4
#EXTINF:-1,Bargain Loving Brits in the Sun Season 2			
http://vod1.freeddns.org:80/1518018170/series/BargainLovingBritsInTheSun-s02e04.mp4
#EXTINF:-1,Barney: The Best of Barney			
http://vod3.freeddns.org:80/14920271211/ThebestofBarney.mp4
#EXTINF:-1,Barracuda			
http://vod3.freeddns.org:80/195181173146/Barracuda.mp4
#EXTINF:-1,Barry			
http://vod3.freeddns.org:80/14920271211/barry.mp4
#EXTINF:-1,Barsaat			
http://vod5.freeddns.org:80/95154195215/boxoffice/Barsaat.mp4
#EXTINF:-1,Barton Fink			
http://vod3.freeddns.org:80/1492028071/BartonFink.mp4
#EXTINF:-1,Bas Ek Chance (Gujarati)			
http://vod3.freeddns.org:80/51254199141/BasEkChance.mp4
#EXTINF:-1,Based on a True Story			
http://vod3.freeddns.org:80/145239129162/old0619/Based.On.A.True.Story.2017.720p.BluRay.x264.mp4
#EXTINF:-1,Basic Instinct			
http://vod3.freeddns.org:80/217182172100/basicinstinct.mp4
#EXTINF:-1,Basic Instinct 2			
http://vod3.freeddns.org:80/217182172100/basicinstinct2.mp4
#EXTINF:-1,Baskin			
http://vod3.freeddns.org:80/195181164146/Baskin.mp4
#EXTINF:-1,Bastille Day			
http://vod3.freeddns.org:80/14920271211/bastilleday.mp4
#EXTINF:-1,Bastille Live at Glastonbury			
http://vod3.freeddns.org:80/1492028071/bastillelive.mp4
#EXTINF:-1,Batla House			
http://vod3.freeddns.org:80/195181173146/BatlaHouse.mp4
#EXTINF:-1,Batman			
http://vod1.freeddns.org:80/519692115/Batman.mp4
#EXTINF:-1,Batman & Bill			
http://vod3.freeddns.org:80/51254199141/batman&bill.mp4
#EXTINF:-1,Batman & Mr. Freeze: SubZero			
http://vod3.freeddns.org:80/1492028071/batman-mrfreezesubzero.mp4
#EXTINF:-1,Batman & Robin			
http://vod1.freeddns.org:80/1518018170/batrob.mp4
#EXTINF:-1,Batman and Harley Quinn			
http://vod3.freeddns.org:80/195181164146/BatmanAndHarleyQuinn.mp4
#EXTINF:-1,Batman Ninja			
http://vod5.freeddns.org:80/95154195215/boxoffice/Batman.Ninja.2018.720p.BluRay.x264.mp4
#EXTINF:-1,Batman Returns			
http://vod1.freeddns.org:80/519692115/BatmanReturns.mp4
#EXTINF:-1,Batman Unlimited: Monster Mayhem			
http://vod3.freeddns.org:80/151809610/BatmanUn.mp4
#EXTINF:-1,Batman vs. Teenage Mutant Ninja Turtles			
http://vod3.freeddns.org:80/14920266145/BatmanVsTeenageMutantNinjaTurtles-2019.mp4
#EXTINF:-1,Batman vs. Two-Face			
http://vod3.freeddns.org:80/217182164125/BatmanTwoFace.mp4
#EXTINF:-1,Batman: Assault on Arkham			
http://vod1.freeddns.org:80/1482511210/BatmanAss.mp4
#EXTINF:-1,Batman: Bad Blood			
http://vod1.freeddns.org:80/519692115/batmanbad.mp4
#EXTINF:-1,Batman: Gotham by Gaslight			
http://vod3.freeddns.org:80/195181164146/BatmanGaslight.mp4
#EXTINF:-1,Batman: Hush			
http://vod3.freeddns.org:80/14920266145/Batman.Hush.2019.1080p.WEB-DL.DD5.1.H264-FGT.mp4
#EXTINF:-1,Batman: Mystery of the Batwoman			
http://vod3.freeddns.org:80/1492028071/batman-mysteryofthebatwoman.mp4
#EXTINF:-1,Batman: The Killing Joke			
http://vod3.freeddns.org:80/1492028071/batman-thekillingjoke.mp4
#EXTINF:-1,Bats			
http://vod3.freeddns.org:80/195181173146/movies/Bats-1999.mp4
#EXTINF:-1,Batti Gul Meter Chalu			
http://vod3.freeddns.org:80/145239129162/old0619/Batti.Gul.Meter.Chalu.mp4
#EXTINF:-1,Battle of Britain			
http://vod3.freeddns.org:80/195181173146/movies/BattleOfBritain-1969.mp4
#EXTINF:-1,Battle of the 80s Supercars with David Hasselhoff			
http://vod3.freeddns.org:80/195181173146/battle.of.the.80s.supercars.with.david.hasselhoff.2019.720p.web.h264-tbs.mp4
#EXTINF:-1,Battle of the Bulge (English Subs)			
http://vod3.freeddns.org:80/195181164146/BattleofTheBulge.mp4
#EXTINF:-1,Battle of the Sexes			
http://vod3.freeddns.org:80/195181164146/BattleOfTheSexes2017.mp4
#EXTINF:-1,Battle Royale			
http://vod1.freeddns.org:80/519692115/BattleRoyale.mp4
#EXTINF:-1,Bayam Oru Payanam			
http://vod3.freeddns.org:80/195181173146/BayamOruPayanam.mp4
#EXTINF:-1,Bayou Caviar			
http://vod3.freeddns.org:80/145239129162/old0619/BayouCaviar-2018.mp4
#EXTINF:-1,Baywatch 2017			
http://vod3.freeddns.org:80/519682224/baywatch2017.mp4
#EXTINF:-1,Bazaar			
http://vod3.freeddns.org:80/195181173146/Bazaar.mp4
#EXTINF:-1,BBC - Chinese New Year - The Biggest Celebration on Earth			
http://vod3.freeddns.org:80/1492026922/Chinese-s01e03.mp4
#EXTINF:-1,BBC - Rome: A History Of The Eternal City (Mini-Series)			
http://vod3.freeddns.org:80/14920271211/series/BBC-Rome-AHistoryOfTheEternalCity-s01e03.mp4
#EXTINF:-1,BBC - The Sky at Night - The Mystery of Oumuamua (English Subs)			
http://vod3.freeddns.org:80/217182164138/BBC.The.Sky.at.Night.2018.The.Mystery.of.Oumuamua.mp4
#EXTINF:-1,BBC - The Sky at Night- The Invisible Universe (English Subs)			
http://vod1.freeddns.org:80/14920220391/BBC.The.Sky.at.Night.2018.The.Invisible.Universe.mp4
#EXTINF:-1,BBC - Voyager: To the Final Frontier			
http://vod3.freeddns.org:80/1492026922/Voyager.mp4
#EXTINF:-1,BBC : Exodus: Our Journey			
http://vod3.freeddns.org:80/195181164146/Exodus-s01e03.mp4
#EXTINF:-1,BBC : The Truth About Stress			
http://vod3.freeddns.org:80/519682224/BBCTheTruthAboutStress.mp4
#EXTINF:-1,BBC :The Human Body Secrets Of Your Life Revealed			
http://vod3.freeddns.org:80/195181164146/HumanBody-s01e03.mp4
#EXTINF:-1,BBC Aliens The Big Think			
http://vod1.freeddns.org:80/1518018170/bbcalien.mp4
#EXTINF:-1,BBC Charles Darwin and the Tree of Life			
http://vod3.freeddns.org:80/51254199141/BBC-CharlesDarwinAndTheTreeOfLife.mp4
#EXTINF:-1,BBC David Bowie and the Story of Ziggy Stardust			
http://vod3.freeddns.org:80/217182172100/Ziggy.mp4
#EXTINF:-1,BBC Drugsland (Mini-Series)			
http://vod1.freeddns.org:80/14920220391/series/BBCDrugsland-s01e04.mp4
#EXTINF:-1,BBC George Best: All by Himself			
http://vod3.freeddns.org:80/1492028071/BBCGeorgeBest.mp4
#EXTINF:-1,BBC Heroes of the Somme			
http://vod3.freeddns.org:80/14920271211/Somme.mp4
#EXTINF:-1,BBC Hiroshima			
http://vod3.freeddns.org:80/151809610/series/BBC-Hiroshima-s01e02.mp4
#EXTINF:-1,BBC Horizon - Oceans of Our Solar System			
http://vod3.freeddns.org:80/51254199141/HorizonOceans.mp4
#EXTINF:-1,BBC Horizon - Which Universe Are We In?			
http://vod3.freeddns.org:80/51254199141/HorizonWhich.mp4
#EXTINF:-1,BBC Horizon 10 Things You Need to Know About the Future			
http://vod1.freeddns.org:80/1518018170/BBCHorizon10Things.mp4
#EXTINF:-1,BBC Horizon 2017 Mars A Travellers Guide			
http://vod3.freeddns.org:80/195181164146/HorizonMars.mp4
#EXTINF:-1,BBC Horizon Clean Eating The Dirty Truth			
http://vod3.freeddns.org:80/1492028071/cleaneating.mp4
#EXTINF:-1,BBC Horizon Curing Alzheimer\s			
http://vod3.freeddns.org:80/51254199141/Alz.mp4
#EXTINF:-1,BBC Horizon How To Find Love Online			
http://vod1.freeddns.org:80/1518018170/BBC-Horizon-HowToFindLoveOnline.mp4
#EXTINF:-1,BBC Horizon My Amazing Twin			
http://vod1.freeddns.org:80/1518018170/BBCHorizon-MyAmazingTwin.mp4
#EXTINF:-1,BBC Horizon Project Greenglow - The Quest for Gravity Control			
http://vod3.freeddns.org:80/51254199141/Greenglow.mp4
#EXTINF:-1,BBC Horizon The End of The Solar System			
http://vod3.freeddns.org:80/1492028071/HorizonSolar.mp4
#EXTINF:-1,BBC Horizon The Lost Tribes of Humanity			
http://vod3.freeddns.org:80/51254199141/HorizonLost.mp4
#EXTINF:-1,BBC Horizon The Mystery of Dark Energy			
http://vod3.freeddns.org:80/1492028071/HorizonDark.mp4
#EXTINF:-1,BBC Horizon The Wildest Weather in the Universe			
http://vod3.freeddns.org:80/51254199141/HorizonWild.mp4
#EXTINF:-1,BBC In the Shadow of Red October			
http://vod3.freeddns.org:80/195181164146/IntheShadowofRedOctober.mp4
#EXTINF:-1,BBC Louis Theroux - Transgender Kids			
http://vod3.freeddns.org:80/151809610/Trans1.mp4
#EXTINF:-1,BBC Louis Theroux By Reason of Insanity			
http://vod3.freeddns.org:80/151809610/series/BBC-LouisTheroux-ByReasonOfInsanity-s01e02.mp4
#EXTINF:-1,BBC Louis Theroux Drinking To Oblivion			
http://vod1.freeddns.org:80/1518018170/bbcdrinking.mp4
#EXTINF:-1,BBC MOTD Euro 2016 Highlights 20 June 2016			
http://vod3.freeddns.org:80/1492026922/MOTD200616.mp4
#EXTINF:-1,BBC MOTD Euro 2016 Highlights 21 June 2016			
http://vod3.freeddns.org:80/1492026922/MOTD210616.mp4
#EXTINF:-1,BBC Music Awards 2016			
http://vod3.freeddns.org:80/51254199141/bbcmusicawards2016.mp4
#EXTINF:-1,BBC Our World - The Trauma of War (English Subs)			
http://vod1.freeddns.org:80/14920220391/BBC.Our.World.2018.The.Trauma.of.War.mp4
#EXTINF:-1,BBC Our World : Madagascar\s Sapphire Rush			
http://vod3.freeddns.org:80/195181164146/BBCOurWorldMada.mp4
#EXTINF:-1,BBC Our World the European Dream			
http://vod1.freeddns.org:80/1518018170/EUDream.mp4
#EXTINF:-1,BBC Our World: China\s New Silk Road			
http://vod3.freeddns.org:80/519682224/BBCOurWorld2017ChinasNewSilkRoad.mp4
#EXTINF:-1,BBC Panorama : Africa\s Billion Pound Migrant Trail			
http://vod3.freeddns.org:80/195181164146/BBCAfricaBillion.mp4
#EXTINF:-1,BBC Panorama : Hate On The Street			
http://vod3.freeddns.org:80/195181164146/BBCPanoramaHate.mp4
#EXTINF:-1,BBC Panorama: Germanys New Nazis			
http://vod3.freeddns.org:80/195181164146/BBCPanoramaGermanysNewNazis.mp4
#EXTINF:-1,BBC Panorama: North Koreas Nuclear Trump Card			
http://vod3.freeddns.org:80/195181164146/PanoramaTrumpCard.mp4
#EXTINF:-1,BBC Proms 2016			
http://vod3.freeddns.org:80/51254199141/bbcproms2016-s01e02.mp4
#EXTINF:-1,BBC Proms: David Bowie			
http://vod3.freeddns.org:80/1492026922/bowienight.mp4
#EXTINF:-1,BBC SAS: Rogue Warriors (Mini-Series)			
http://vod3.freeddns.org:80/14920271211/series/BBCSAS-RogueWarriors-s01e03.mp4
#EXTINF:-1,BBC The Art of Japanese Life (Mini-Series)			
http://vod3.freeddns.org:80/51254199141/TheArtofJapaneseLife-s01e03.mp4
#EXTINF:-1,BBC This World : The Balfour Declaration: Britain\s Promise to the Holy Land			
http://vod3.freeddns.org:80/195181164146/BBC.This.World.The.Balfour.Declaration.mp4
#EXTINF:-1,BBC This World Russias Hooligan Army			
http://vod3.freeddns.org:80/14920271211/RussiasHooligan.mp4
#EXTINF:-1,BBC. The Royal Wedding of Prince Harry and Meghan Markle - Highlights of the Big Day			
http://vod5.freeddns.org:80/95154195215/boxoffice/BBCTheRoyalWedding.mp4
#EXTINF:-1,BBC: Britain\s Lost Masterpieces (Mini-Series)			
http://vod3.freeddns.org:80/195181164146/series/LostMasterpieces-s01e07.mp4
#EXTINF:-1,BBC: Britain\s Teenage Drug Runners			
http://vod3.freeddns.org:80/195181164146/TeenageDrugRunners.mp4
#EXTINF:-1,BBC: Concorde: A Supersonic Story			
http://vod3.freeddns.org:80/195181164146/BBCConcorde.mp4
#EXTINF:-1,BBC: Damming the Nile			
http://vod3.freeddns.org:80/195181164146/BBC.Damming.the.Nile.720p.HDTV.x264.AAC.mp4
#EXTINF:-1,BBC: Drugs Map of Britain Fentanyl Deadlier Than Heroin			
http://vod3.freeddns.org:80/195181164146/BBCDrugs.mp4
#EXTINF:-1,BBC: NASA: Triumph and Tragedy			
http://vod3.freeddns.org:80/217182164138/NASATriumph-s01e02.mp4
#EXTINF:-1,BBC: Sea Cities (Mini-Series)			
http://vod3.freeddns.org:80/195181164146/series/SeaCities-s01e03.mp4
#EXTINF:-1,BBC: Secrets Of Silicon Valley			
http://vod3.freeddns.org:80/195181164146/BBCSecretsOfSiliconValley-s01e02.mp4
#EXTINF:-1,BBC: Strong Language Live 2017			
http://vod3.freeddns.org:80/195181164146/BBCStrongLanguageLive.mp4
#EXTINF:-1,BBC: The Art of Tommy Cooper			
http://vod1.freeddns.org:80/13774202158/BBC.mp4
#EXTINF:-1,BBC: The Sky at Night - Return to the Moon?			
http://vod3.freeddns.org:80/195181164146/ReturnToTheMoon.mp4
#EXTINF:-1,BBC: The Sky at Night. - Cassini: The Gamechanger			
http://vod3.freeddns.org:80/195181164146/Cassini.mp4
#EXTINF:-1,BBC: Wild China			
http://vod3.freeddns.org:80/195181164146/series/WildChina-s01e06.mp4
#EXTINF:-1,Be Kind Rewind			
http://vod1.freeddns.org:80/519692115/BeKindRewind.mp4
#EXTINF:-1,Beach Blanket Bingo			
http://vod3.freeddns.org:80/195181164146/BeachBlanketBingo.mp4
#EXTINF:-1,Beach Rats			
http://vod3.freeddns.org:80/195181164146/BeachRats.mp4
#EXTINF:-1,Beaches			
http://vod3.freeddns.org:80/195181164146/Beaches.mp4
#EXTINF:-1,Beacon Point			
http://vod3.freeddns.org:80/1492028071/beaconpoint.mp4
#EXTINF:-1,Bear Grylls: Breaking Point Season 1			
http://vod3.freeddns.org:80/14920271211/series/BearGrylls-BreakingPoint-s01e04.mp4
#EXTINF:-1,Bears			
http://vod3.freeddns.org:80/151809610/Bears.mp4
#EXTINF:-1,Beast of Burden			
http://vod3.freeddns.org:80/195181164146/BeastOfBurden2018.mp4
#EXTINF:-1,Beasts of No Nation			
http://vod1.freeddns.org:80/519692115/BeastsNation.mp4
#EXTINF:-1,Beautiful Boy			
http://vod3.freeddns.org:80/145239129162/old0619/Beautiful.Boy.2018.720p.WEBRip.x264.mp4
#EXTINF:-1,Beautiful Kate			
http://vod1.freeddns.org:80/519692115/BeautifulKate.mp4
#EXTINF:-1,Beauty and the Beast (1991)			
http://vod1.freeddns.org:80/13774202158/BeautyB.mp4
#EXTINF:-1,Beauty and the Beast (2017)			
http://vod3.freeddns.org:80/51254199141/BeautyandtheBeast.mp4
#EXTINF:-1,Beauty and the Beast 3D			
http://vod3.freeddns.org:80/195181164146/BeautyAndTheBeast20173D.mp4
#EXTINF:-1,Beauty and the Beast: The Enchanted Christmas			
http://vod3.freeddns.org:80/195181164146/BeautyBeastEnchantedChristmas1997.mp4
#EXTINF:-1,Beavis and Butt-Head Do America			
http://vod3.freeddns.org:80/195181164146/beavisandbuttheaddo.mp4
#EXTINF:-1,Becoming Warren Buffett			
http://vod3.freeddns.org:80/217182164138/BecomingWarrenBuffett.mp4
#EXTINF:-1,Bedevilled			
http://vod1.freeddns.org:80/519692115/Bedevilled.mp4
#EXTINF:-1,Bedknobs and Broomsticks			
http://vod3.freeddns.org:80/217182172100/bedknobs.mp4
#EXTINF:-1,Bedtime Stories			
http://vod1.freeddns.org:80/519692115/BedtimeStories.mp4
#EXTINF:-1,Bee Team (Hindi)			
http://vod3.freeddns.org:80/195181173146/BeeTeam-Hindi.mp4
#EXTINF:-1,Beerland Season 3			
http://vod3.freeddns.org:80/145239129162/Beerland-s03e06.mp4
#EXTINF:-1,Befikre			
http://vod3.freeddns.org:80/1492028071/Befikre.mp4
#EXTINF:-1,Before I Fall			
http://vod3.freeddns.org:80/14920271211/beforeifall.mp4
#EXTINF:-1,Before Midnight			
http://vod3.freeddns.org:80/195181164146/BeforeMidnight.mp4
#EXTINF:-1,Before Sunrise (german dub)			
http://vod1.freeddns.org:80/1482511210/BeforeSunrise.mp4
#EXTINF:-1,Before the Devil Knows You\re Dead			
http://vod1.freeddns.org:80/519692115/BeforeTheDevilKnowsYoureDead.mp4
#EXTINF:-1,Before the Flood			
http://vod3.freeddns.org:80/14920271211/beforetheflood.mp4
#EXTINF:-1,Begin Again			
http://vod1.freeddns.org:80/95154195215h/movies/BeginAgain-2013.mp4
#EXTINF:-1,Behen Hogi Teri			
http://vod3.freeddns.org:80/51254199141/BehenHogiTeri.mp4
#EXTINF:-1,Behind the Screen			
http://vod3.freeddns.org:80/195181173146/Behind.The.Screen.1916.720p.BluRay.x264.mp4
#EXTINF:-1,Being Serena			
http://vod1.freeddns.org:80/14523911226/docs/BeingSerena-s01e05.mp4
#EXTINF:-1,Being There			
http://vod3.freeddns.org:80/195181164146/BeingThere1979.mp4
#EXTINF:-1,Beirut			
http://vod3.freeddns.org:80/145239129162/old0619/Beirut-2018.mp4
#EXTINF:-1,Bekaaboo Season 1			
http://vod3.freeddns.org:80/195181173146/BekaabooS1.mp4
#EXTINF:-1,Bel Canto			
http://vod3.freeddns.org:80/145239129162/old0619/BelCanto-2018.mp4
#EXTINF:-1,Bellator 142 Dynamite 1 Ortiz v McGeary			
http://vod3.freeddns.org:80/151809610/Bellator142.mp4
#EXTINF:-1,Bellator 144 Halsey vs Carvalho			
http://vod1.freeddns.org:80/519692115/Bellator144.mp4
#EXTINF:-1,Bellator 153			
http://vod3.freeddns.org:80/1492028071/bellator153.mp4
#EXTINF:-1,Bellator 158 London			
http://vod1.freeddns.org:80/1518018170/Bellator158.mp4
#EXTINF:-1,Bellator 159 Caldwell vs Taimanglo			
http://vod3.freeddns.org:80/51254199141/Bellator159.mp4
#EXTINF:-1,Bellator 160 Henderson vs Pitbull			
http://vod1.freeddns.org:80/1518018170/Bellator160.mp4
#EXTINF:-1,Bellator 165			
http://vod1.freeddns.org:80/1518018170/Bellator165.mp4
#EXTINF:-1,Bellator 175: Rampage vs. King Mo 2			
http://vod3.freeddns.org:80/14920271211/sport/Bellator175.mp4
#EXTINF:-1,Bellator 176 Carvalho vs Manhoef 2			
http://vod3.freeddns.org:80/51254199141/bellator176.mp4
#EXTINF:-1,Bellator 177 Dantas vs Higo			
http://vod3.freeddns.org:80/51254199141/bellator177.mp4
#EXTINF:-1,Bellator 179 MMA			
http://vod3.freeddns.org:80/151809784/Bellator179.mp4
#EXTINF:-1,Bellator 179 MMA Prelims			
http://vod3.freeddns.org:80/151809784/Bellator179Prelims.mp4
#EXTINF:-1,Bellator 183: Henderson vs. Pitbull			
http://vod1.freeddns.org:80/14920220391/Bellator183.mp4
#EXTINF:-1,Bellator 186			
http://vod3.freeddns.org:80/217182164138/bellator186.mp4
#EXTINF:-1,Bellator 187: McKee vs Moore			
http://vod3.freeddns.org:80/195181164146/bellator187.mp4
#EXTINF:-1,Bellator 190: Carvalho vs. Sakara			
http://vod3.freeddns.org:80/195181164146/bellator190.mp4
#EXTINF:-1,Bellator 191: McDonald vs. Ligier			
http://vod1.freeddns.org:80/14920220391/Bellator191.mp4
#EXTINF:-1,Bellator 192: Lima Vs. Macdonald			
http://vod1.freeddns.org:80/14920220391/Bellator192.mp4
#EXTINF:-1,Bellator 194: Nelson vs. Mitrione			
http://vod3.freeddns.org:80/195181164146/Bellator194.mp4
#EXTINF:-1,Bellator 198: Fedor vs. Mir			
http://vod1.freeddns.org:80/14523911226/ufc/Bellator198.mp4
#EXTINF:-1,Bellator 199: Bader vs. King Mo			
http://vod1.freeddns.org:80/14523911226/ufc/Bellator199.mp4
#EXTINF:-1,Bellator 200: Carvalho vs. Mousasi			
http://vod1.freeddns.org:80/14523911226/ufc/Bellator200.mp4
#EXTINF:-1,Bellator 201			
http://vod1.freeddns.org:80/14523911226/ufc/Bellator201.mp4
#EXTINF:-1,Bellator 202: Budd vs. Nogueira			
http://vod3.freeddns.org:80/145239129162/bellator202.mp4
#EXTINF:-1,Bellator 203: Pitbull vs. Weichel 2			
http://vod3.freeddns.org:80/145239129162/ufc/Bellator203.mp4
#EXTINF:-1,Bellator 204: Caldwell vs. Lahat			
http://vod3.freeddns.org:80/195181173146/ufc/Bellator204.mp4
#EXTINF:-1,Bellator 205: McKee vs. Macapá			
http://vod3.freeddns.org:80/145239129162/bellator205.mkv
#EXTINF:-1,Bellator 206: Mousasi vs. MacDonald			
http://vod3.freeddns.org:80/195181173146/ufc/bellator206.mp4
#EXTINF:-1,Bellator 207: Mitrione vs. Bader			
http://vod3.freeddns.org:80/195181173146/ufc/Bellator207.mp4
#EXTINF:-1,Bellator 208: Fedor vs. Sonnen			
http://vod3.freeddns.org:80/145239129162/bellator208.mkv
#EXTINF:-1,Bellator 209: Pitbull vs. Sanchez			
http://vod3.freeddns.org:80/195181173146/ufc/Bellator209.mp4
#EXTINF:-1,Bellator 210: Njokuani vs. Salter			
http://vod3.freeddns.org:80/145239129162/bellator210.mp4
#EXTINF:-1,Bellator 212: Primus vs Chandler 2			
http://vod3.freeddns.org:80/195181173146/Bellator.212.and.USO.Present.Primus.vs.Chandler.2.HDTV.x264-Star.mp4
#EXTINF:-1,Bellator 213 - Macfarlane vs Letourneau			
http://vod3.freeddns.org:80/195181173146/Bellator213.mp4
#EXTINF:-1,Bellator 214: Fedor vs. Bader			
http://vod3.freeddns.org:80/195181173146/ufc/Bellator214-s01e02.mp4
#EXTINF:-1,Bellator 215			
http://vod3.freeddns.org:80/195181173146/ufc/Bellator215-s01e02.mp4
#EXTINF:-1,Bellator 216: MVP vs Daley			
http://vod3.freeddns.org:80/195181173146/ufc/Bellator216.mp4
#EXTINF:-1,Bellator 217: Gallagher vs. Graham			
http://vod3.freeddns.org:80/195181173146/ufc/Bellator217-s01e02.mp4
#EXTINF:-1,Bellator 218			
http://vod3.freeddns.org:80/195181173146/ufc/Bellator218-s01e02.mp4
#EXTINF:-1,Bellator 219			
http://vod3.freeddns.org:80/195181173146/ufc/Bellator219-s01e02.mp4
#EXTINF:-1,Bellator 220: MacDonald vs. Fitch			
http://vod3.freeddns.org:80/195181173146/ufc/Bellator220.mp4
#EXTINF:-1,Bellator 221: Chandler vs. Pitbull			
http://vod3.freeddns.org:80/195181173146/ufc/Bellator221.mp4
#EXTINF:-1,Bellator 222			
http://vod3.freeddns.org:80/195181173146/ufc/Bellator222.mp4
#EXTINF:-1,Bellator 223: London			
http://vod3.freeddns.org:80/195181173146/ufc/Bellator223.mp4
#EXTINF:-1,Bellator 224			
http://vod3.freeddns.org:80/195181173146/ufc/Bellator224.mp4
#EXTINF:-1,Bellator 225: Mitrione vs. Kharitonov 2			
http://vod3.freeddns.org:80/195181173146/ufc/Bellator225.mp4
#EXTINF:-1,Bellator 226: Bader vs. Kongo			
http://vod3.freeddns.org:80/195181173146/ufc/Bellator226.mp4
#EXTINF:-1,Bellator 227: Henderson vs. Jury			
http://vod3.freeddns.org:80/195181173146/ufc/Bellator227.mp4
#EXTINF:-1,Bellator 230			
http://vod3.freeddns.org:80/195181173146/ufc/Bellator230.mp4
#EXTINF:-1,Bellator 232: MacDonald vs. Lima 2			
http://vod3.freeddns.org:80/195181173146/ufc/Bellator232.mp4
#EXTINF:-1,Bellator 233			
http://vod3.freeddns.org:80/195181173146/ufc/Bellator233.mp4
#EXTINF:-1,Bellator 235 - MVP vs Melillo			
http://vod3.freeddns.org:80/195181173146/ufc/Bellator235.mp4
#EXTINF:-1,Bellator 237: Fedor vs. Rampage			
http://vod3.freeddns.org:80/195181173146/ufc/Bellator237.mp4
#EXTINF:-1,Belong To Us			
http://vod1.freeddns.org:80/519692115/BelongToUs.mp4
#EXTINF:-1,Below the Surface Season 1 (Eng Subs)			
http://vod3.freeddns.org:80/145239129162/BelowTheSurface-s01e08.mp4
#EXTINF:-1,Ben 10 - Alien Swarm			
http://vod3.freeddns.org:80/195181164146/Ben10-AlienSwarm.mp4
#EXTINF:-1,Ben 10: Destroy All Aliens			
http://vod3.freeddns.org:80/195181164146/Ben10-DestroyAllAliens.mp4
#EXTINF:-1,Ben 10: Race Against Time			
http://vod3.freeddns.org:80/195181164146/Ben10-RaceAgainstTime.mp4
#EXTINF:-1,Ben 10: Secret of the Omnitrix			
http://vod3.freeddns.org:80/195181164146/Ben10-SecretOfTheOmnitrix.mp4
#EXTINF:-1,Ben Fogle: New Lives In The Wild Season 6			
http://vod3.freeddns.org:80/195181164146/series/BenFogleNewLivesInTheWild-s06e08.mp4
#EXTINF:-1,Ben Fogle\s The Great African Migration			
http://vod3.freeddns.org:80/51254199141/BenFogle-TheGreatAfricanMigration.mp4
#EXTINF:-1,Benched			
http://vod3.freeddns.org:80/145239129162/old0619/Benched-2018.mp4
#EXTINF:-1,Benefits Britain: Life on the Dole Season 2			
http://vod1.freeddns.org:80/148251187141/series/BenefitsBritain-LifeOnTheDole-s02e09.mp4
#EXTINF:-1,Ben-Hur			
http://vod1.freeddns.org:80/148251187141/BenHur.mp4
#EXTINF:-1,Benji			
http://vod5.freeddns.org:80/95154195215/boxoffice/Benji.2018.720p.WEBRip.x264.mp4
#EXTINF:-1,Benny Hill Collection Vol 1			
http://vod3.freeddns.org:80/14920271211/series/BennyHillCollection-s01e11.mp4
#EXTINF:-1,Benny Hill Collection Vol 2			
http://vod3.freeddns.org:80/14920271211/series/BennyHillCollection-s02e10.mp4
#EXTINF:-1,Benny Hill Collection Vol 3			
http://vod3.freeddns.org:80/14920271211/series/BennyHillCollection-s03e18.mp4
#EXTINF:-1,Bent			
http://vod5.freeddns.org:80/95154195215/boxoffice/Bent-2018.mp4
#EXTINF:-1,Beowulf Season 1			
http://vod3.freeddns.org:80/217182172100/series/Beowulf-s01e11.mp4
#EXTINF:-1,Berlin			
http://vod3.freeddns.org:80/14920266145/BerlinILoveYou-2019.mp4
#EXTINF:-1,Berlin Calling (German)			
http://vod3.freeddns.org:80/195181173146/movies/BerlinCalling-2008.mp4
#EXTINF:-1,Berlin Syndrome			
http://vod3.freeddns.org:80/195181164146/BerlinSyndrome.mp4
#EXTINF:-1,Bernard Manning - An Audience With Bernard And Friends			
http://vod3.freeddns.org:80/195181173146/standup/BernardManning-AnAudienceWithBernardAndFriends.mp4
#EXTINF:-1,Bernard Manning - Bernard Bites Back			
http://vod3.freeddns.org:80/195181173146/standup/BernardManning-BernardBitesBack.mp4
#EXTINF:-1,Bernard Manning - From Beyond The Grave			
http://vod3.freeddns.org:80/195181173146/standup/BernardManning-FromBeyondTheGrave.mp4
#EXTINF:-1,Bernard Manning - On the Job			
http://vod3.freeddns.org:80/195181173146/standup/BernardManning-OnTheJob.mp4
#EXTINF:-1,Bernard Manning - Shootin\ From The Lip			
http://vod3.freeddns.org:80/195181173146/standup/BernardManning-ShootinFromTheLip.mp4
#EXTINF:-1,Bernard Manning - Ungagged			
http://vod3.freeddns.org:80/195181173146/standup/BernardManning-Ungagged.mp4
#EXTINF:-1,Bessie			
http://vod3.freeddns.org:80/151809610/Bessie.mp4
#EXTINF:-1,Best F(r)iends: Volume 2			
http://vod3.freeddns.org:80/145239129162/old0619/BestFriendsVolume2-2018.mp4
#EXTINF:-1,Best of Enemies			
http://vod1.freeddns.org:80/519692115/BestOfEnemies.mp4
#EXTINF:-1,Best of the Best			
http://vod3.freeddns.org:80/195181164146/BestOfBest.mp4
#EXTINF:-1,Best of the Best 3: No Turning Back			
http://vod3.freeddns.org:80/195181173146/BestOfBest3.mp4
#EXTINF:-1,Beta Test			
http://vod3.freeddns.org:80/51254199141/BetaTest.mp4
#EXTINF:-1,Betrayal Season 1			
http://vod3.freeddns.org:80/195181164146/series/Betrayal-s01e13.mp4
#EXTINF:-1,Better Watch Out			
http://vod3.freeddns.org:80/217182164125/BetterWatchOut.mp4
#EXTINF:-1,Between Two Ferns: The Movie			
http://vod1.freeddns.org:80/95154195215h/movies/BetweenTwoFernsTheMovie-2019.mp4
#EXTINF:-1,Beverly Hills Cop			
http://vod1.freeddns.org:80/519692115/Beverly.mp4
#EXTINF:-1,Beverly Hills Cop II			
http://vod3.freeddns.org:80/14920271211/beverly2.mp4
#EXTINF:-1,Beverly Hills Cop III			
http://vod3.freeddns.org:80/14920271211/beverly3.mp4
#EXTINF:-1,Bewakoofiyaan			
http://vod3.freeddns.org:80/1492026922/Bewkoofiyan.mp4
#EXTINF:-1,Beware the Slenderman			
http://vod3.freeddns.org:80/51254199141/BewareSlenderman.mp4
#EXTINF:-1,Bewitched			
http://vod1.freeddns.org:80/519692115/Bewitched.mp4
#EXTINF:-1,Bey Yaar (Gujarati)			
http://vod1.freeddns.org:80/519692115/BeyYaar.mp4
#EXTINF:-1,Beyonce Lemonade Music Videos			
http://vod3.freeddns.org:80/1492028071/Beyoncelemonade.mp4
#EXTINF:-1,Beyond Boundaries: The Harvey Weinstein Scandal			
http://vod3.freeddns.org:80/195181173146/Beyond.Boundaries.The.Harvey.Weinstein.Scandal.2018.720p.WEBRip.x264.mp4
#EXTINF:-1,Beyond Stranger Things			
http://vod3.freeddns.org:80/195181164146/BeyondStrangerThings-s01e07.mp4
#EXTINF:-1,Beyond the Clouds			
http://vod3.freeddns.org:80/195181164146/BeyondtheClouds.mp4
#EXTINF:-1,Beyond the Lights			
http://vod3.freeddns.org:80/195181164146/BeyondLights.mp4
#EXTINF:-1,Beyond the Reach			
http://vod1.freeddns.org:80/1482511210/BeyondReach.mp4
#EXTINF:-1,Beyond The Sky			
http://vod3.freeddns.org:80/145239129162/old0619/BeyondTheSky-2018.mp4
#EXTINF:-1,Bhaag Johnny			
http://vod1.freeddns.org:80/519692115/BhaagJohnny.mp4
#EXTINF:-1,Bhaag Milkha Bhaag			
http://vod3.freeddns.org:80/151809610/Bhaag.mp4
#EXTINF:-1,Bhaagte Raho			
http://vod3.freeddns.org:80/195181173146/BhaagteRaho.mp4
#EXTINF:-1,Bhagat Singh Di Udeek (Punjabi)			
http://185.229.191.7.2080/video/BhagatSinghDiUdeek.mp4
#EXTINF:-1,Bhaiaji Superhitt			
http://vod3.freeddns.org:80/195181173146/BhaiajiSuperhit.mp4
#EXTINF:-1,Bharat			
http://vod3.freeddns.org:80/195181173146/Bharat.mp4
#EXTINF:-1,Bhaskar Oru Rascal			
http://vod3.freeddns.org:80/195181173146/BhaskarOruRascal.mp4
#EXTINF:-1,Bhavesh Joshi Superhero			
http://vod3.freeddns.org:80/145239129162/BhaveshJoshiSuperhero.mp4
#EXTINF:-1,Bhool Bhulaiyaa			
http://vod3.freeddns.org:80/51254199141/BhoolBhulaiyaa.mp4
#EXTINF:-1,Bhoomi			
http://vod3.freeddns.org:80/195181164146/Bhoomi.mp4
#EXTINF:-1,Bhoothnath Returns			
http://vod3.freeddns.org:80/151809610/BhoothnathReturnsA.mp4
#EXTINF:-1,Bhouri			
http://vod3.freeddns.org:80/195181173146/Bhouri.mp4
#EXTINF:-1,Bicentennial Man			
http://vod3.freeddns.org:80/195181173146/Bicentennial.Man.1999.720p.BluRay.x264.mp4
#EXTINF:-1,Big			
http://vod3.freeddns.org:80/195181164146/BIG.mp4
#EXTINF:-1,Big Brother UK Season 18			
http://vod3.freeddns.org:80/1492028071/series/bigbrother-s18e54.mp4
#EXTINF:-1,Big Brother UK Season 19			
http://vod3.freeddns.org:80/145239129162/BigBrotherUK-s19e45.mp4
#EXTINF:-1,Big Cats			
http://vod3.freeddns.org:80/195181164146/series/BigCats-S01E01.mp4
#EXTINF:-1,Big Fat Liar			
http://vod3.freeddns.org:80/195181173146/movies/BigFatLiar-2002.mp4
#EXTINF:-1,Big Hero 6			
http://vod3.freeddns.org:80/195181164146/BigHero6.mp4
#EXTINF:-1,Big Hero 6 (3D)			
http://vod3.freeddns.org:80/151809610//BigHero3D.mp4
#EXTINF:-1,Big Jake			
http://vod1.freeddns.org:80/1518018170/bigjake.mp4
#EXTINF:-1,Big Jay Oakerson: Live at Webster Hall			
http://vod3.freeddns.org:80/51254199141/BigJay.mp4
#EXTINF:-1,Big Kill			
http://vod3.freeddns.org:80/14920266145/BigKill-2018.mp4
#EXTINF:-1,Big Momma\s House			
http://vod1.freeddns.org:80/519692115/BigMommasHouse1.mp4
#EXTINF:-1,Big Momma\s House 2			
http://vod1.freeddns.org:80/519692115/BigMommasHouse2.mp4
#EXTINF:-1,Big Pacific Season 1			
http://vod3.freeddns.org:80/145239129162/BigPacific-s01e05.mp4
#EXTINF:-1,Big Top Pee-wee			
http://vod3.freeddns.org:80/195181173146/Big.Top.Pee-wee.1988.720p.WEBRip.x264.mp4
#EXTINF:-1,Big Trouble in Little China			
http://vod1.freeddns.org:80/1482511210/BigTrouble.mp4
#EXTINF:-1,Bigg Boss Season 12			
http://vod3.freeddns.org:80/195181173146/BiggBoss-s12e105.mp4
#EXTINF:-1,Bigg Boss Season 12 Premiere			
http://vod3.freeddns.org:80/195181173146/BiggBoss12Premiere.mp4
#EXTINF:-1,Bigger Fatter Liar			
http://vod3.freeddns.org:80/51254199141/BiggerFatterLiar.mp4
#EXTINF:-1,Biggie: The Life of Notorious B.I.G.			
http://vod3.freeddns.org:80/195181164146/Biggie.mp4
#EXTINF:-1,Bilal: A New Breed of Hero			
http://vod3.freeddns.org:80/195181173146/Bilal.A.New.Breed.of.Hero.2015.720p.BluRay.H264.AAC-RARBG.mp4
#EXTINF:-1,Bill Burr: I\m Sorry You Feel That Way			
http://vod3.freeddns.org:80/195181173146/standup/BillBurr-ImSorryYouFeelThatWay-2014.mp4
#EXTINF:-1,Bill Burr: Walk Your Way Out			
http://vod3.freeddns.org:80/1518026228/BillBurr-WalkYourWayOut.mp4
#EXTINF:-1,Bill Hicks: Revelations			
http://vod1.freeddns.org:80/519692115/BillHicks-Revelations.mp4
#EXTINF:-1,Billion Dollar Bully			
http://vod3.freeddns.org:80/195181164146/BillionDollarBully.mp4
#EXTINF:-1,Billionaire Boy			
http://vod3.freeddns.org:80/51254199141/BillionaireBoy.mp4
#EXTINF:-1,Billionaire Boys Club			
http://vod5.freeddns.org:80/95154195215/boxoffice/BillionaireBoysClub-2018.mp4
#EXTINF:-1,Billy Bathgate			
http://vod3.freeddns.org:80/519682224/BillyBathgate-1991.mp4
#EXTINF:-1,Billy Connolly Live Dublin 2002			
http://vod1.freeddns.org:80/13774202158/Billy1.mp4
#EXTINF:-1,Billy Connolly: Erect for 30 Years			
http://vod1.freeddns.org:80/1482511210/Erect30.mp4
#EXTINF:-1,Billy Connolly: You Asked for it			
http://vod1.freeddns.org:80/1482511210/BiLLYcBiNGO.mp4
#EXTINF:-1,Billy Elliot			
http://vod1.freeddns.org:80/519692115/BillyElliot.mp4
#EXTINF:-1,Billy Joe Saunders Vs Willie Monroe 16/09/17			
http://vod3.freeddns.org:80/195181164146/BillyJoeMonroe.mp4
#EXTINF:-1,Billy Lynn\s Long Halftime Walk 3D			
http://vod3.freeddns.org:80/195181164146/BillyLynnsLongHalftimeWalk3D.mp4
#EXTINF:-1,Billy Madison			
http://vod3.freeddns.org:80/14920266145/BillyMadison-1995.mp4
#EXTINF:-1,Bioscopewala			
http://vod3.freeddns.org:80/145239129162/Bioscopewala.mp4
#EXTINF:-1,Bird Box			
http://vod3.freeddns.org:80/145239129162/old0619/BirdBox-2018.mp4
#EXTINF:-1,Bird on a Wire			
http://vod3.freeddns.org:80/195181173146/movies/BirdOnAWire-1990.mp4
#EXTINF:-1,Birdman			
http://vod1.freeddns.org:80/13774202158/Birdman.mp4
#EXTINF:-1,Birth of the Dragon			
http://vod3.freeddns.org:80/217182132110/BirthoftheDragon.mp4
#EXTINF:-1,Bitcoin: The End of Money as We Know It			
http://vod1.freeddns.org:80/1518018170/Bitcoin.mp4
#EXTINF:-1,Bitter Lake			
http://vod3.freeddns.org:80/195181173146/docs/BitterLake-2015.mp4
#EXTINF:-1,Black			
http://vod1.freeddns.org:80/519692115/Black.mp4
#EXTINF:-1,Black Butterfly			
http://vod1.freeddns.org:80/1518018170/BlackButterfly.mp4
#EXTINF:-1,Black Car			
http://vod1.freeddns.org:80/519692115/blackcar.mp4
#EXTINF:-1,Black Coal			
http://vod3.freeddns.org:80/195181164146/BlackCoalThinIce.mp4
#EXTINF:-1,Black Coffee			
http://vod3.freeddns.org:80/195181173146/BlackCoffee-s01e02.mp4
#EXTINF:-1,Black Earth Rising			
http://vod3.freeddns.org:80/145239129162/BlackEarthRising-s01e08.mp4
#EXTINF:-1,Black Fury			
http://vod3.freeddns.org:80/195181173146/Black.Fury.1935.WEBRip.XviD.MP3-XVID.mp4
#EXTINF:-1,Black Mass			
http://vod3.freeddns.org:80/51254199141/blackmass.mp4
#EXTINF:-1,Black Mass (French)			
http://vod1.freeddns.org:80/519692115/BlackMass-fr.mp4
#EXTINF:-1,Black Mirror: Bandersnatch			
http://vod3.freeddns.org:80/145239129162/old0619/BlackMirrorBandersnatch-2018.mp4
#EXTINF:-1,Black or White			
http://vod1.freeddns.org:80/519692115/BlackWhite.mp4
#EXTINF:-1,Black Pond			
http://vod3.freeddns.org:80/195181173146/Black.Pond.2011.720p.WEBRip.x264.mp4
#EXTINF:-1,Black Rock			
http://vod3.freeddns.org:80/195181164146/BlackRock.mp4
#EXTINF:-1,Black Sea			
http://vod3.freeddns.org:80/151809610/BlackSea.mp4
#EXTINF:-1,Black Swan			
